fossil_id,description,object_name,strat_type,period,taxonomy,url
7789,Partially fossilised mandible of the youngest of the juvenile Shropshire mammoths. Found at Condover quarry during excavations. Dated to approximately 14000 years bp.,Woolly mammoth,"Biostratigraphy, Chronostratigraphy",Cenozoic Era,Mammuthus primigenius,https://data.nhm.ac.uk/media/ludlow:G.10724.002a.jpg; https://data.nhm.ac.uk/media/ludlow:G.10724.002b.jpg; https://data.nhm.ac.uk/media/ludlow:G.10724.002c.jpg
8690,Fossillised remains of the Jurassic boney fish Dapedium.,Fish,Chronostratigraphy,Jurassic Period,Dapedium,https://data.nhm.ac.uk/media/ludlow:G.20222.jpg
9189,"Fossilised remains of shells of the Silurian gastropod, Platyschisma helicites (Sow.)",Gastropod,Chronostratigraphy,Silurian Period,Platyschisma helicites,https://data.nhm.ac.uk/media/ludlow:shyms_g_1977_0750.001.jpg
8988,Microscope thin section made from a hand specimen of sandstone from Grinshill.,Sandstone,Chronostratigraphy,Triassic Period,,https://data.nhm.ac.uk/media/ludlow:G.20551.015a.jpg; https://data.nhm.ac.uk/media/ludlow:G.20551.015b.jpg; https://data.nhm.ac.uk/media/ludlow:G.20551.015c.jpg; https://data.nhm.ac.uk/media/ludlow:G.20551.015d.jpg; https://data.nhm.ac.uk/media/ludlow:G.20551.015e.jpg
9243,Fossilised shell remains of the Ordovician brachiopod Resserella paracyclica found at Gretton.,Brachiopod,"Biostratigraphy, Chronostratigraphy",Ordovician Period,Resserella paracyclica,https://data.nhm.ac.uk/media/ludlow:shyms_g_1994_0395.jpg
9192,"Sample of Precambrian igneous rock, Amygdaloidal Bostonite. Found on Caer Caradoc, Shropshire.",Igneous Rock,Chronostratigraphy,Precambrian Eon,,https://data.nhm.ac.uk/media/ludlow:shyms_g_1977_0806.jpg
7914,"Parts of  the Silurian fossil brachiopods, Pentamerus oblongus, Eocoelia curtisi and  Leptaena lobata also cricoconarida, Tentaculites sp. found at Norbury",Brachiopod,Chronostratigraphy,Silurian Period,Pentamerus oblongus; Eocoelia curtisi; Leptaena lobata; Tentaculites sp.,https://data.nhm.ac.uk/media/ludlow:G.12201a.jpg; https://data.nhm.ac.uk/media/ludlow:G.12201b.jpg
9210,"Fossilised remains of headshield of the Devonian jawless fish Pteraspis sp. found at Morville, Shropshire.",Fish,Chronostratigraphy,Devonian Period,Pteraspis sp.,https://data.nhm.ac.uk/media/ludlow:shyms_g_1982_052.jpg
9007,Microscope thin section of sandstone made from a hand specimen collected at Soudley.,Sandstone,Chronostratigraphy,Ordovician Period,,https://data.nhm.ac.uk/media/ludlow:G.20563.003a.jpg; https://data.nhm.ac.uk/media/ludlow:G.20563.003b.jpg; https://data.nhm.ac.uk/media/ludlow:G.20563.003c.jpg
7800,"Fossilised remains of a complete exoskeleton of Ordovician trilobite, Flexiycalymene sp., Found at Meifod, Powys",Trilobite,Chronostratigraphy,Ordovician Period,Flexiycalymene sp.,https://data.nhm.ac.uk/media/ludlow:G.11215a.jpg; https://data.nhm.ac.uk/media/ludlow:G.11215b.jpg
9249,Silurian assemblage found on Wenlock Edge,Assemblage,Chronostratigraphy,Silurian Period,,https://data.nhm.ac.uk/media/ludlow:shyms_g_2013_0003.jpg
8052,"Fossilised remains of one valve of the Carboniferous articulate brachiopod, Gigantoproductus giganteus, found at Penygraig, Froncyllte. Specimen shows strong radial ribbing.",Brachiopod,Chronostratigraphy,Carboniferous Period,Gigantoproductus giganteus,https://data.nhm.ac.uk/media/ludlow:G.13307.jpg
9214,"Fossilised remains of head shield of the Carboniferous fish Megalichthys sp. Found at Coalbrookdale, Shropshire.",Fish,"Chronostratigraphy, Lithostratigraphy",Carboniferous Period,Megalichthys sp.,https://data.nhm.ac.uk/media/ludlow:shyms_g_1982_075.001.jpg
8763,"Fossilised shell remains of the Cenozoic gastropod, Cerithium sedgwickii. Part of the Charles Ashford Collection.",Gastropod,Chronostratigraphy,Cenozoic Era,Cerithium sedgwickii,https://data.nhm.ac.uk/media/ludlow:G.20295.003.jpg
8147,Fossilised shell remains of the Ordovician brachiopod Bicuspina spiriferoides found at Marshbrook.,Brachiopod,Chronostratigraphy,Ordovician Period,Bicuspina spiriferoides,https://data.nhm.ac.uk/media/ludlow:G.14096.jpg
8739,"Fossilised right valve of the Pliocene bivalve, Pecten coalingensis. The valve is almost equilateral and possesses a pronounced 'ear' on each side of the umbo. Mounted on card. Found in the Kettlemon Hills, California.",BIVALVE,"Chronostratigraphy, Lithostratigraphy",Cenozoic Era,Pecten coalingensis,https://data.nhm.ac.uk/media/ludlow:G.20264.jpg
8056,"Fossilised remains of the Carboniferous brachiopod Spinifer sp. found in County Fermanagh, Ireland",Brachiopod,Chronostratigraphy,Carboniferous Period,Spirifer sp.,https://data.nhm.ac.uk/media/ludlow:G.13355.jpg; https://data.nhm.ac.uk/media/ludlow:G.13355b.jpg
8881,"Assemblage of Silurian brachiopods, bryozoa and trilobite fragments, including Dolerorthis rustica. Found at Wren's Nest.",Brachiopod,"Chronostratigraphy, Lithostratigraphy",Silurian Period,Dolerorthis rustica,https://data.nhm.ac.uk/media/ludlow:G.20430a.jpg; https://data.nhm.ac.uk/media/ludlow:G.20430b.jpg
9014,Microscope thin section of porphyritic basalt made from a hand specimen collected from a dyke at Grinshill Quarry.,Igneous Rock,Chronostratigraphy,Cenozoic Era,Basalt,https://data.nhm.ac.uk/media/ludlow:G.20566.006a.jpg; https://data.nhm.ac.uk/media/ludlow:G.20566.006b.jpg; https://data.nhm.ac.uk/media/ludlow:G.20566.006c.jpg; https://data.nhm.ac.uk/media/ludlow:G.20566.006d.jpg; https://data.nhm.ac.uk/media/ludlow:G.20566.006e.jpg
8864,Fossilised remains of a non-calcified alga. Similar appearance to Inocaulis.,Plant,"Chronostratigraphy, Lithostratigraphy",Silurian Period,,https://data.nhm.ac.uk/media/ludlow:G.20406a.jpg; https://data.nhm.ac.uk/media/ludlow:G.20406b.jpg
9262,"Ironstone nodule from the Carboniferous of Shropshire, containing the fossil of a shark egg case, Palaeoxyris. The specimen bears resemblance to lycopod plant remains.",Plant,"Chronostratigraphy, Lithostratigraphy",Carboniferous Period,Palaeoxyris helicteroides,https://data.nhm.ac.uk/media/ludlow:shyms_g_2019_0027.jpg
8782,"Fossilised shell remains of a Teritiary gastropod found in grey fine clay, Water Lane, Walford.",Gastropod,Chronostratigraphy,Cenozoic Era,GASTROPODA,https://data.nhm.ac.uk/media/ludlow:G.20317.003.jpg
7818,"Fossilised remains of pygidium and thorax of the Silurian trilobite, Dalmanites myops. Found at Downto Gorge.",Trilobite,"Chronostratigraphy, Lithostratigraphy",Silurian Period,Dalmanites myops,https://data.nhm.ac.uk/media/ludlow:G.11621.jpg
8766,"Coarse-grained red coloured Devonian sandstone, locally called Cornstone. Found at Clee St.Margaret.",Sandstone,Chronostratigraphy,Devonian Period,,https://data.nhm.ac.uk/media/ludlow:G.20299.jpg
8057,"Fossil remains of the Carboniferous compound rugose coral, Lithostrotion sp. with phaceloid coralla.",CORAL,Chronostratigraphy,Carboniferous Period,Lithostrotion sp.,https://data.nhm.ac.uk/media/ludlow:G.13381a.jpg; https://data.nhm.ac.uk/media/ludlow:G.13381b.jpg
9263,Ironstone nodule form the carboniferous of Shropshire containing the fossilised remains of a plant stem. The fossil preserves much of the three dimensional nature of the original plant structure. Found at Coalbrookdale.,Plant,"Chronostratigraphy, Lithostratigraphy",Carboniferous Period,Plantae,https://data.nhm.ac.uk/media/ludlow:shyms_g_2019_0028.jpg
9032,"Microscope thin section of sandstone, made from a hand specimen collected at Grinshill.",Igneous Rock,Chronostratigraphy,Triassic Period,Sandstone,https://data.nhm.ac.uk/media/ludlow:G.20572.002a.jpg; https://data.nhm.ac.uk/media/ludlow:G.20572.002b.jpg; https://data.nhm.ac.uk/media/ludlow:G.20572.002c.jpg; https://data.nhm.ac.uk/media/ludlow:G.20572.002d.jpg; https://data.nhm.ac.uk/media/ludlow:G.20572.002e.jpg
7819,"Fossilised remains of pygidium and thorax of the Silurian trilobite Dalmanites caudatus found at Buildwas, Shropshire.",Trilobite,"Chronostratigraphy, Lithostratigraphy",Silurian Period,Dalmanites caudatus,https://data.nhm.ac.uk/media/ludlow:G.11637.jpg
8915,Microscope thin section of Permian Bridgnorth Sandstone. Found at Bridgnorth.,Sandstone,Chronostratigraphy,Permian Period,,https://data.nhm.ac.uk/media/ludlow:G.20506.003a.jpg; https://data.nhm.ac.uk/media/ludlow:G.20506.003b.jpg; https://data.nhm.ac.uk/media/ludlow:G.20506.003c.jpg
7824,"Fossilised remains of thorax and pygidium of the Silurian triloibite Encrinurus punctatus found at Wrens Nest, Dudley.",Trilobite,"Chronostratigraphy, Lithostratigraphy",Silurian Period,Encrinurus punctatus,https://data.nhm.ac.uk/media/ludlow:G.11728.jpg
8989,Hand specimen of Precambrian Longmyndian Greywacke found at Bayston Hill.,,Chronostratigraphy,Precambrian Eon,,https://data.nhm.ac.uk/media/ludlow:G.20552.001.jpg
7992,"Fine-grained sandstone, Tarporley siltstone, with adhesion ripples which were formed by wind blowing over half-dry sand. Found at Grinshill Quarry.",Sandstone,"Chronostratigraphy, Lithostratigraphy",Triassic Period,,https://data.nhm.ac.uk/media/ludlow:G.12914.jpg
8876,"Assemblage of Silurian brachiopods including Dayia navicula, Atrypa reticularis  and Sphaerirhynchia wilsoni. Found at Mocktree Quarry.",Brachiopod,"Chronostratigraphy, Lithostratigraphy",Silurian Period,Dayia navicula; Atrypa reticularis; Sphaerirhynchia wilsoni,https://data.nhm.ac.uk/media/ludlow:G.20425a.jpg; https://data.nhm.ac.uk/media/ludlow:G.20425b.jpg
8772,Fossilised single shell valve of the Cenozoic bivalve Crassatella sulcata.,BIVALVE,Chronostratigraphy,Cenozoic Era,Crassatella sulcata,https://data.nhm.ac.uk/media/ludlow:G.20310.jpg
8866,"Fossilised remains of the sponge, Plectoderma sp. Contained within a fine grained silty sandstone and displaying a series of lines, representing growth development.",Sponge,Chronostratigraphy,Silurian Period,Plectoderma sp.,https://data.nhm.ac.uk/media/ludlow:G.20409a.jpg; https://data.nhm.ac.uk/media/ludlow:G.20409b.jpg
8997,Microscope thin section of Carboniferous limestone. Made from a hand specimen collected at Llanymynech.,Limestone,Chronostratigraphy,Carboniferous Period,,https://data.nhm.ac.uk/media/ludlow:G.20555.004a.jpg; https://data.nhm.ac.uk/media/ludlow:G.20555.004b.jpg; https://data.nhm.ac.uk/media/ludlow:G.20555.004c.jpg; https://data.nhm.ac.uk/media/ludlow:G.20555.004d.jpg; https://data.nhm.ac.uk/media/ludlow:G.20555.004e.jpg
7998,Fossilised shell remains of the Silurian bivalve Orbiculoidea rugata found in the Leintwardine district,BIVALVE,Chronostratigraphy,Silurian Period,Orbiculoidea rugata,https://data.nhm.ac.uk/media/ludlow:G.13000a.jpg; https://data.nhm.ac.uk/media/ludlow:G.13000b.jpg
9156,"Fossilised Ordovician brachiopod, Resserella canalis. Found at Folly Bank, Shropshire.",Brachiopod,"Biostratigraphy, Chronostratigraphy",Ordovician Period,Resserella canalis,https://data.nhm.ac.uk/media/ludlow:shyms_g_1977_0414.002.jpg
8801,"A buff coloured, finely laminated, sandy clay. Collected from within the Tunbridge Wells Sand at Tonbridge.",Clay,"Chronostratigraphy, Lithostratigraphy",Cretaceous Period,,https://data.nhm.ac.uk/media/ludlow:G.20338b.jpg; https://data.nhm.ac.uk/media/ludlow:G.20338a.jpg
7831,"Fossilised remains of the Silurian trilobite Decoroproetus wigwig showing cephalon, thorax and pygidium. Found at Buildwas, Shropshire. Counterpart of G.11786.001",Trilobite,"Chronostratigraphy, Lithostratigraphy",Silurian Period,Decoroproetus wigwig,https://data.nhm.ac.uk/media/ludlow:G.11786.002.jpg
9188,"Fossilised remains of scales and spines of  the Siluian agnathan fish Thelodus sp. Found at Munslow, Shropshire.",Fish,Chronostratigraphy,Silurian Period,Thelodus sp.,https://data.nhm.ac.uk/media/ludlow:shyms_g_1977_0747.jpg
8879,Assemblage of Silurian brachiopods from the Rubery sandstone. The original shells have been disolved out to leave casts and moulds of the internal and external surfaces. Found at Rubery.,Brachiopod,"Chronostratigraphy, Lithostratigraphy",Silurian Period,BRACHIOPODA,https://data.nhm.ac.uk/media/ludlow:G.20428.jpg
8007,"A medium grained, hypabyssal lamprophrye collected from Uriconian rocks at Maddock's Hill Quarry, Shropshire. Brick-red (plagioclase feldspar), black (iron-magnesium mineral, possibly pyroxene) and green (possibly chlorite)  can be clearly observed.",Camptonite,Chronostratigraphy,Precambrian Eon,,https://data.nhm.ac.uk/media/ludlow:G.13068.jpg
7846,"Fossilised remains of a complete Silurian bivalve Praeclinodonta ludensis, found at Upper Millichops",BIVALVE,"Chronostratigraphy, Lithostratigraphy",Silurian Period,Praeclinodonta ludensis,https://data.nhm.ac.uk/media/ludlow:G.11903.jpg
9135,"Fossil dendroid graptolite, Dictyonema cobboldi. Found in the Ordovician Mytton Flags near Shelve, Shropshire.",Graptolite,"Chronostratigraphy, Lithostratigraphy",Ordovician Period,Dictyonema cobboldi,https://data.nhm.ac.uk/media/ludlow:shyms_g_1977_0114.jpg
8015,"A sample of fine grained, pinkish red, Precambrian rhyolitic lava. Collected  from Uriconian rocks at the Ercall, Shropshire.",Rhyolite,Chronostratigraphy,Precambrian Eon,Rhyolite,https://data.nhm.ac.uk/media/ludlow:G.13111.jpg
8190,"Fossilised remains of stem of a giant carboniferous horsetail, Calamites sp.",Plant,Chronostratigraphy,Carboniferous Period,Calamites sp.,https://data.nhm.ac.uk/media/ludlow:G.14364.jpg
8823,"Sample of sedimentary slump structure found in the Silurian rocks at Leintwardine, Shropshire.",Sedimentary structure,Chronostratigraphy,Silurian Period,Slump Structure,https://data.nhm.ac.uk/media/ludlow:G.20360.jpg
8125,"Fossil remains of the Ordovician brachiopod Harknessella vespertilio. Found by Wood, B. at Marshbrook.",Brachiopod,Chronostratigraphy,Ordovician Period,Harknessella vespertilio,https://data.nhm.ac.uk/media/ludlow:G.13832.jpg
9171,"Fossilised shell valve remains of the Carboniferous brachiopod, Linoproductus hemisphericus. Found at Little Wenlock, Shropshire.",Brachiopod,Chronostratigraphy,Carboniferous Period,,https://data.nhm.ac.uk/media/ludlow:shyms_g_1977_0615.jpg
8951,Microscope thin section of a Carboniferous crinoidal limestone found at Llanymynech.,Limestone,Chronostratigraphy,Carboniferous Period,,https://data.nhm.ac.uk/media/ludlow:G.20529.003a.jpg; https://data.nhm.ac.uk/media/ludlow:G.20529.003b.jpg; https://data.nhm.ac.uk/media/ludlow:G.20529.003c.jpg; https://data.nhm.ac.uk/media/ludlow:G.20529.003d.jpg; https://data.nhm.ac.uk/media/ludlow:G.20529.003e.jpg
9186,"Fossilised remains of the Silurian worm, Trachyderma coriacea, possibly showing a sediment filled gut as ientified by Botting and Muir 2017. Found in Ludlow.",Annelid,Chronostratigraphy,Silurian Period,Trachyderma coriacea,https://data.nhm.ac.uk/media/ludlow:shyms_g_1977_0722.jpg
8681,"An almost complete guard of the Jurassic belemnite, Cuspriteuris tubularis. The guard is slender and flattened. At the anterior end, a large section of phragmocone is preserved. Collected from the Alum Shales at Black Nab, Whitby.",Belemnite,Chronostratigraphy,Jurassic Period,Cuspriteurhis tubularis,https://data.nhm.ac.uk/media/ludlow:G.20212.jpg
9217,Skull including lower jaw of Triassic Rhynchosaur from Grinshill Quarries.,Reptile,"Chronostratigraphy, Lithostratigraphy",Triassic Period,Rhynchosaurus articeps,https://data.nhm.ac.uk/media/ludlow:shyms_g_1982_132.jpg; https://data.nhm.ac.uk/media/ludlow:shyms_g_1982_132b.jpg
9145,"Fossil brachiopod, Discina striata. Silurian: Wenlock Limestone.",Brachiopod,"Chronostratigraphy, Lithostratigraphy",Silurian Period,Discina striata,https://data.nhm.ac.uk/media/ludlow:shyms_g_1977_0235.001.jpg
9194,Fossilised shell remains of a Jurassic ammonite,AMMONITE,Chronostratigraphy,Jurassic Period,Ammonoidea,https://data.nhm.ac.uk/media/ludlow:shyms_g_1977_0847.jpg
7881,"Fossilised remains of the Silurian coral, Favosites sp. found in South Shropshire.",CORAL,"Chronostratigraphy, Lithostratigraphy",Silurian Period,Favosites sp.,https://data.nhm.ac.uk/media/ludlow:G.12038.jpg
9229,"Well preserved example of the Cystoid Macrocystella mariae. Found at Sheinton, Shropshire.",Cystoid,"Chronostratigraphy, Lithostratigraphy",Ordovician Period,Macrocystella mariae,https://data.nhm.ac.uk/media/ludlow:shyms_g_1994_0192.jpg
8063,Precambrian micaceous siltstone. Found at Haughmond Hill.,Siltstone,Chronostratigraphy,Precambrian Eon,Siltstone,https://data.nhm.ac.uk/media/ludlow:G.13398.jpg
8964,Microscope thin section of a quartz rich Cambrian sandstone known locally as Wrekin Quartzite.,Quartzite,"Chronostratigraphy, Lithostratigraphy",Cambrian Period,,https://data.nhm.ac.uk/media/ludlow:G.20543.005a.jpg; https://data.nhm.ac.uk/media/ludlow:G.20543.005b.jpg; https://data.nhm.ac.uk/media/ludlow:G.20543.005c.jpg; https://data.nhm.ac.uk/media/ludlow:G.20543.005d.jpg; https://data.nhm.ac.uk/media/ludlow:G.20543.005e.jpg
8936,Hand specimen of tuff from the Ordovician Stapeley Volcanics found at Stapeley. Specimen has been cut on one side to make thin sections.,Stapeley Volcanics,"Chronostratigraphy, Lithostratigraphy",Ordovician Period,Tuff,https://data.nhm.ac.uk/media/ludlow:G.20517.001.jpg
9236,"Fossil Trilobite, Ordovician period, found at Onny River Section. Presented to Shrewsbury Museum by R.A. Buddicom Esq.",Trilobite,"Biostratigraphy, Chronostratigraphy",Ordovician Period,Onnia superba,https://data.nhm.ac.uk/media/ludlow:shyms_g_1994_0332.jpg
8967,Hand specimen of Precambrian Longmyndian Greywacke found at Bayston Hill.,,Chronostratigraphy,Precambrian Eon,,https://data.nhm.ac.uk/media/ludlow:G.20548.001.jpg
9154,"Fossilised Ordovician brachiopod, Heterorthis alternata. Found at Soudley quarry.",Brachiopod,"Biostratigraphy, Chronostratigraphy",Ordovician Period,Heterorthis alternata,https://data.nhm.ac.uk/media/ludlow:shyms_g_1977_0412.jpg
9238,"Fossil Trilobite, Ordovician period, found at Onny River Section. Presented to Shrewsbury Museum by R.A. Buddicom Esq.",Trilobite,Chronostratigraphy,Ordovician Period,Onnia superba,https://data.nhm.ac.uk/media/ludlow:shyms_g_1994_0338.jpg
8720,Fossilised Cretaceous sponge within a flint nodule.,Sponge,Chronostratigraphy,Cretaceous Period,,https://data.nhm.ac.uk/media/ludlow:G.20252.jpg
9230,Fossilised remains of Cambrian trilobites Parabolinella triarthra. Remains of the Cyanobacterium Morania are also present as black markings in the matrix which is rare in these rocks. Found at Shineton Brook,Trilobite; Cyanobacterium,Chronostratigraphy,Cambrian Period,Parabolinella triarthra; Morania sp.,https://data.nhm.ac.uk/media/ludlow:shyms_g_1994_0223.jpg
8170,"Fossilised remains of the Carboniferous rugose coral, Amplexus coralloides",CORAL,Chronostratigraphy,Carboniferous Period,Amplexus coralloides,https://data.nhm.ac.uk/media/ludlow:G.14238a.jpg; https://data.nhm.ac.uk/media/ludlow:G.14238b.jpg; https://data.nhm.ac.uk/media/ludlow:G.14238c.jpg
9256,"Beige-coloured sandstone containing the fossilised remains of the vertebra, ribs and partial shoulder of the Triassic reptile Rhychosaurus articeps. This specimen is a part of a group of fossils donated to Shrewsbury Museum in the 19th Century, one of which forms the type specimen for this species.",REPTILIA,"Biostratigraphy, Chronostratigraphy",Triassic Period,Rhynchosaurus articeps,https://data.nhm.ac.uk/media/ludlow:shyms_g_2019_0021a.jpg; https://data.nhm.ac.uk/media/ludlow:shyms_g_2019_0021b.jpg
8878,Assemblage of Silurian brachiopods including Protochonetes ludloviensis and Salopina lunata. The matrix also contains some crinoid ossicles and indeterminate bryozoan fragments. Found at Tinker's Hill Wood.,Brachiopod,"Chronostratigraphy, Lithostratigraphy",Silurian Period,Protochonetes ludloviensis; Salopina lunata,https://data.nhm.ac.uk/media/ludlow:G.20427.jpg
8722,"Fossilised clay concretion, containing the skeleton of an indeterminate Pleistocene fossil fish. The skeleton is near complete, with gill flaps visible in the head area. Individual vertebrae are clearly defined and fins are well preserved. Found in Greenland. Counterpart to G.20254.002",Fish,Chronostratigraphy,Cenozoic Era,,https://data.nhm.ac.uk/media/ludlow:G.20254.001a.jpg; https://data.nhm.ac.uk/media/ludlow:G.20254.001b.jpg
9159,Fossilised shell valve remains of the Ordovician brachiopod Trematis punctata (Sow). Found at Folly Bank near Enchmarsh.,Brachiopod,Chronostratigraphy,Ordovician Period,Trematis punctata,https://data.nhm.ac.uk/media/ludlow:shyms_g_1977_0418.003.jpg
9266,Fossilised remains of a shell valve from the Cretaceous bivalve Hinnites sp. Found in Cambridge.,BIVALVE,"Chronostratigraphy, Lithostratigraphy",Cretaceous Period,Hinnites sp.,https://data.nhm.ac.uk/media/ludlow:shyms_g_2019_0043.jpg
8124,Fossilised remains of the Ordovician brachiopod Harknessella vespertilio. Found at Cardington.,Brachiopod,Chronostratigraphy,Ordovician Period,Harknessella vespertilio,https://data.nhm.ac.uk/media/ludlow:G.13830.jpg
7903,Fossilised shell remains of the Silurian brachiopod Rhynchospirina sp. found on Wenlock Edge.,Brachiopod,"Chronostratigraphy, Lithostratigraphy",Silurian Period,Rhynchospirina sp.,https://data.nhm.ac.uk/media/ludlow:G.12121.001.jpg
9252,"Pygidium of the Silurian trilobite Dalmanites myops. Found at Affcot, near Craven Arms in the Wenlock Shales.",Trilobite,Chronostratigraphy,Silurian Period,Dalmanites myops,https://data.nhm.ac.uk/media/ludlow:shyms_g_2019_0014.001.jpg
6650,"An internal cast of one valve of the Ordovician articulate brachiopod, Dalmanella unguis. Found at Marshwood, Shropshire. Counterpart of G.00055.002. Original Ludlow Natural History Society specimen.",Brachiopod,"Chronostratigraphy, Lithostratigraphy",Ordovician Period,Dalmanella unguis,https://data.nhm.ac.uk/media/ludlow:G.00055.001.jpg
8731,"Fossilised fish fragments from the Cretaceous Period, found at Hanover point, Isle of Wight.",Fish,Chronostratigraphy,Cretaceous Period,,https://data.nhm.ac.uk/media/ludlow:G.20261.001.jpg
8893,Hand specimen of Old Red Sandstone from the Brown Clee area. The specimen shows clear green-coloured spots caused by the reduction of iron.,Sandstone,Chronostratigraphy,Devonian Period,Sandstone,https://data.nhm.ac.uk/media/ludlow:G.20502.001.jpg
8953,Microscope thin section of a Carboniferous crinoidal limestone found at Llanymynech.,Limestone,Chronostratigraphy,Carboniferous Period,,https://data.nhm.ac.uk/media/ludlow:G.20529.005a.jpg; https://data.nhm.ac.uk/media/ludlow:G.20529.005b.jpg; https://data.nhm.ac.uk/media/ludlow:G.20529.005c.jpg; https://data.nhm.ac.uk/media/ludlow:G.20529.005d.jpg; https://data.nhm.ac.uk/media/ludlow:G.20529.005e.jpg
6713,"Fossilised remains of the Silurian brachiopod, Eospirifer radiatus found at Mocktree",Brachiopod,"Chronostratigraphy, Lithostratigraphy",Silurian Period,Eospirifer radiatus,https://data.nhm.ac.uk/media/ludlow:G.01037.jpg
8892,"Thin section of Carboniferous Dolorite, also known as Dhustone, found at Clee Hill.",,Chronostratigraphy,Carboniferous Period,,https://data.nhm.ac.uk/media/ludlow:G.20501.003a.jpg; https://data.nhm.ac.uk/media/ludlow:G.20501.003b.jpg; https://data.nhm.ac.uk/media/ludlow:G.20501.003c.jpg; https://data.nhm.ac.uk/media/ludlow:G.20501.003d.jpg; https://data.nhm.ac.uk/media/ludlow:G.20501.002e.jpg; https://data.nhm.ac.uk/media/ludlow:G.20501.003f.jpg; https://data.nhm.ac.uk/media/ludlow:G.20501.003g.jpg
8979,Microscope thin section made from a hand specimen of sandstone from Grinshill.,Sandstone,Chronostratigraphy,Triassic Period,,https://data.nhm.ac.uk/media/ludlow:G.20551.006a.jpg; https://data.nhm.ac.uk/media/ludlow:G.20551.006b.jpg; https://data.nhm.ac.uk/media/ludlow:G.20551.006c.jpg; https://data.nhm.ac.uk/media/ludlow:G.20551.006d.jpg; https://data.nhm.ac.uk/media/ludlow:G.20551.006e.jpg
8994,Hand specimen of Carboniferous limestone found at Llanymynech.,Limestone,Chronostratigraphy,Carboniferous Period,,https://data.nhm.ac.uk/media/ludlow:G.20555.001.jpg
8955,Thin section of a precambrian basalt found at Caer Caradoc.,Basalt,Chronostratigraphy,Precambrian Eon,,https://data.nhm.ac.uk/media/ludlow:G.20531.002a.jpg; https://data.nhm.ac.uk/media/ludlow:G.20531.002b.jpg; https://data.nhm.ac.uk/media/ludlow:G.20531.002c.jpg; https://data.nhm.ac.uk/media/ludlow:G.20531.002d.jpg; https://data.nhm.ac.uk/media/ludlow:G.20531.002e.jpg; https://data.nhm.ac.uk/media/ludlow:G.20531.002f.jpg; https://data.nhm.ac.uk/media/ludlow:G.20531.002g.jpg; https://data.nhm.ac.uk/media/ludlow:G.20531.002h.jpg; https://data.nhm.ac.uk/media/ludlow:G.20531.002i.jpg
6720,"Fossilised shell remains of the valve of the Silurian articulate brachiopod, Strophonella euglypha, displaying fine radial ribbing.",Brachiopod,Chronostratigraphy,Silurian Period,Strophonella euglypha,https://data.nhm.ac.uk/media/ludlow:G.01396.jpg
8921,Thin section of a Carboniferous limestone found at Llanymynech.,Limestone,Chronostratigraphy,Carboniferous Period,,https://data.nhm.ac.uk/media/ludlow:G.20508.002a.jpg; https://data.nhm.ac.uk/media/ludlow:G.20508.002b.jpg; https://data.nhm.ac.uk/media/ludlow:G.20508.002c.jpg; https://data.nhm.ac.uk/media/ludlow:G.20508.002d.jpg; https://data.nhm.ac.uk/media/ludlow:G.20508.002e.jpg
9009,"Microscope thin section of Ordovician ash, made from a hand specimen collected at Betton, Shelve.",Ash,Chronostratigraphy,Ordovician Period,,https://data.nhm.ac.uk/media/ludlow:G.20565.002a.jpg; https://data.nhm.ac.uk/media/ludlow:G.20565.002b.jpg; https://data.nhm.ac.uk/media/ludlow:G.20565.002c.jpg; https://data.nhm.ac.uk/media/ludlow:G.20565.002d.jpg; https://data.nhm.ac.uk/media/ludlow:G.20565.002e.jpg
8969,Thin section of Precambrian Longmyndian Greywacke found at Bayston Hill,,Chronostratigraphy,Precambrian Eon,,https://data.nhm.ac.uk/media/ludlow:G.20548.003a.jpg; https://data.nhm.ac.uk/media/ludlow:G.20548.003b.jpg; https://data.nhm.ac.uk/media/ludlow:G.20548.003c.jpg; https://data.nhm.ac.uk/media/ludlow:G.20548.003d.jpg; https://data.nhm.ac.uk/media/ludlow:G.20548.003e.jpg
