fossil_id,description,object_name,strat_type,period,taxonomy,url
6856,"Fossilised remains of fragment of the phragmocone of the Silurian cephalopod, Systrophoceras rapax. Strong radial ribbing and an oval whorl section.",Cephalopod,Chronostratigraphy,Silurian Period,Systrophoceras rapax,https://data.nhm.ac.uk/media/ludlow:G.03242.jpg
9250,"Partial skeletal remains of a rhynchosaur from Grinshill. Ventral view including vertebrae, ribs and right forelimb. Part of a collection of material given to Shrewsbury Museum in the 19th Century which includes the type specimen.",Rhynchosaur,"Chronostratigraphy, Lithostratigraphy",Triassic Period,Rhynchosaurus articeps,https://data.nhm.ac.uk/media/ludlow:shyms_g_2015_0004.jpg
6657,"Fossilised remains of the Silurian rugose coral, Kodonophyllum truncatum.",CORAL,"Chronostratigraphy, Lithostratigraphy",Silurian Period,Kodonophyllum truncatum,https://data.nhm.ac.uk/media/ludlow:G.00118a.jpg; https://data.nhm.ac.uk/media/ludlow:G.00118b.jpg; https://data.nhm.ac.uk/media/ludlow:G.00118c.jpg
9232,Fossilised remains of Cambrian trilobites Parabolinella triarthra. Found at Shineton Brook.,Trilobite,Chronostratigraphy,Cambrian Period,Parabolinella triarthra,https://data.nhm.ac.uk/media/ludlow:shyms_g_1994_0225.jpg
6994,Fossilised fragments of the Silurian graptolite Pristiograptus colonus found in Evanhay Lane.,Graptolite,"Chronostratigraphy, Lithostratigraphy",Silurian Period,Pristiograptus colonus,https://data.nhm.ac.uk/media/ludlow:G.03824.jpg
6915,"Fossilised remains of part of the jaw of a Quaternary crocodile, with teeth sockets and broken teeth. Found in the Siwalik Hills, India. Specimen has original collectors labels attached. Ludlow Natural History Society specimen",Crocodile; Jaw,Chronostratigraphy,Cenozoic Era,Crocodylidae,https://data.nhm.ac.uk/media/ludlow:G.03550.001.jpg; https://data.nhm.ac.uk/media/ludlow:G.03550.001b.jpg
9244,Fragmentary examples of the ordiovician brachiopods Reuschella horderleyensis and Dinorthis flabellum from the Horderley area.,Brachiopod,Chronostratigraphy,Ordovician Period,Reuschella horderleyensis; Dinorthis flabellum,https://data.nhm.ac.uk/media/ludlow:shyms_g_1994_0397.jpg
6859,Fossilised remains of the Silurian cephalopod Gomphoceras sp. Found at Leintwardine.,Cephalopod,"Chronostratigraphy, Lithostratigraphy",Silurian Period,Gomphoceras sp.,https://data.nhm.ac.uk/media/ludlow:G.03251.jpg
9261,"Fossilised stem and partial foliage of a carboniferous plant, Sphenophyllum sp.",Plant,Chronostratigraphy,Carboniferous Period,Sphenophyllum sp.,https://data.nhm.ac.uk/media/ludlow:shyms_g_2019_0026.jpg
8870,"Lower Devonian Hunsruck Slate, containing the pyritised fossils of trilobites and other invertebrates.",SLATE,"Chronostratigraphy, Lithostratigraphy",Devonian Period,,https://data.nhm.ac.uk/media/ludlow:G.20415a.jpg; https://data.nhm.ac.uk/media/ludlow:G.20415b.jpg
8980,Microscope thin section made from a hand specimen of sandstone from Grinshill.,Sandstone,Chronostratigraphy,Triassic Period,,https://data.nhm.ac.uk/media/ludlow:G.20551.007a.jpg; https://data.nhm.ac.uk/media/ludlow:G.20551.007b.jpg; https://data.nhm.ac.uk/media/ludlow:G.20551.007c.jpg; https://data.nhm.ac.uk/media/ludlow:G.20551.007d.jpg; https://data.nhm.ac.uk/media/ludlow:G.20551.007e.jpg
6901,"Fossilised remains of headshield of the Silurian heterostracan agnathan fish Phialaspis symondsi found at Devils Hole, Morville, Shropshire.",Fish,Chronostratigraphy,Silurian Period,Phialaspis symondsi,https://data.nhm.ac.uk/media/ludlow:G.03448.jpg
6961,"Fossilised remains of Silurian ostracods, Frostiella groenvilliana, Londinia fissurata, Londinia arisegenesis and Cyrhellina siliqua",Ostracod,Chronostratigraphy,Silurian Period,Frostiella groenvilliana,https://data.nhm.ac.uk/media/ludlow:G.03649a.jpg; https://data.nhm.ac.uk/media/ludlow:G.03649b.jpg
8880,Small piece of Rubery Sandstone containing two brachiopods; Rhynchonella sp and Pentamerus sp. The original shells have been disolved out to leave casts and moulds of the internal and external surfaces. Found at Rubery.,Brachiopod,"Chronostratigraphy, Lithostratigraphy",Silurian Period,Rhynchonella sp.; Pentamerus sp.,https://data.nhm.ac.uk/media/ludlow:G.20429.jpg
6667,"Fossilised fragment of the Silurian brachiopod, Cyrtia exporrecta",Brachiopod,"Chronostratigraphy, Lithostratigraphy",Silurian Period,Cyrtia exporrecta,https://data.nhm.ac.uk/media/ludlow:G.00160.jpg
6975,Fossilised impressions of burrows in Cambrian sedimentary rock. A series of star shaped radiating structures contained within a Cambrian grey shale. Oldhamia antiquae is thought to represent the burrows of a worm like creature which lived beneath an algal mat. Found in Dublin.,Trace fossil,Chronostratigraphy,Cambrian Period,Oldhamia antiquae,https://data.nhm.ac.uk/media/ludlow:G.03731.002.jpg
8925,Thin section of Ordovician siltstone from the Mytton Flags.,Siltstone,Chronostratigraphy,Ordovician Period,,https://data.nhm.ac.uk/media/ludlow:G.20510.003a.jpg; https://data.nhm.ac.uk/media/ludlow:G.20510.003b.jpg; https://data.nhm.ac.uk/media/ludlow:G.20510.003c.jpg
6867,"Fossilised remains of the ventral head shield of the palaeozoic fish Phialaspis symondsi. Found at Devil's Hole, Morville",Fish,Chronostratigraphy,Silurian Period,Phialaspis symondsi,https://data.nhm.ac.uk/media/ludlow:G.03278.jpg
9253,"Pygidium and part of the thorax of the Silurian trilobite Dalmanites myops. Found at Affcot, near Craven Arms in the Wenlock Shales.",Trilobite,Chronostratigraphy,Silurian Period,Dalmanites myops,https://data.nhm.ac.uk/media/ludlow:shyms_g_2019_0014.002.jpg
8888,Thin section of Comley sandstone. Found at Comley,Sandstone,Chronostratigraphy,Cambrian Period,,https://data.nhm.ac.uk/media/ludlow:G.20500.002a.jpg; https://data.nhm.ac.uk/media/ludlow:G.20500.002b.jpg; https://data.nhm.ac.uk/media/ludlow:G.20500.002c.jpg; https://data.nhm.ac.uk/media/ludlow:G.20500.002d.jpg; https://data.nhm.ac.uk/media/ludlow:G.20500.002e.jpg
6991,Fossilised remains of the Silurian graptolite Pristiograptus sp. found at Elton.,Graptolite,"Chronostratigraphy, Lithostratigraphy",Silurian Period,Pristiograptus sp.,https://data.nhm.ac.uk/media/ludlow:G.03820.jpg
6861,"Fossilised remains of phragmocone of the Silurian cephalopod, Cyrtoceras sp. found at Upper Millichope, Shropshire.",Cephalopod,"Chronostratigraphy, Lithostratigraphy",Silurian Period,Cyrtoceras sp.,https://data.nhm.ac.uk/media/ludlow:G.03254.jpg
7022,"Fossilised shell remains of the Silurian gastropod, Pleurotomaria undata",Gastropod,"Biostratigraphy, Chronostratigraphy",Silurian Period,Pleurotomaria undata,https://data.nhm.ac.uk/media/ludlow:G.03986.jpg
6924,Fossilised central section of the metacarpal of a deer from the Siwalik Hills of India.,Deer; Metacarpal,Chronostratigraphy,Cenozoic Era,Cervidae,https://data.nhm.ac.uk/media/ludlow:G.03563a.jpg; https://data.nhm.ac.uk/media/ludlow:G.03563b.jpg; https://data.nhm.ac.uk/media/ludlow:G.03563c.jpg; https://data.nhm.ac.uk/media/ludlow:G.03563d.jpg
8950,Microscope thin section of a Carboniferous crinoidal limestone found at Llanymynech.,Limestone,Chronostratigraphy,Carboniferous Period,,https://data.nhm.ac.uk/media/ludlow:G.20529.002a.jpg; https://data.nhm.ac.uk/media/ludlow:G.20529.002b.jpg; https://data.nhm.ac.uk/media/ludlow:G.20529.002c.jpg; https://data.nhm.ac.uk/media/ludlow:G.20529.002d.jpg; https://data.nhm.ac.uk/media/ludlow:G.20529.002e.jpg
7000,Fossilised remains of a section of the vertebra with ribs belonging to a Triassic Rhynchosaur. Found at Grinshill Quarries.,Rhynchosaur,"Chronostratigraphy, Lithostratigraphy",Triassic Period,Rhynchosaurus articeps,https://data.nhm.ac.uk/media/ludlow:G.03851.jpg
7003,Fossilised remains of tooth of a Jurassic icthyosaur. Found at Lyme Regis.,Ichthyosaur,Chronostratigraphy,Jurassic Period,Ichthyosauria,https://data.nhm.ac.uk/media/ludlow:G.03871.002.jpg
7031,"Fossilised pygidium remains of the Ordovician trilobite Platycalymene duplicata found at Llanfawr Quarry, Llandrindod Wells",Trilobite,Chronostratigraphy,Ordovician Period,Platycalymene duplicata,https://data.nhm.ac.uk/media/ludlow:G.04060.jpg
9260,"Thin buff-coloured sandstone slab containing at least one large footprint, believed to be of Cheirotherium. Found at Grinshill, Shropshire. Original faded label suggests specimen donated ""In memory of John ..... Kilvert esq.""",Trace fossil,"Chronostratigraphy, Lithostratigraphy",Triassic Period,Cheirotherium sp.,https://data.nhm.ac.uk/media/ludlow:shyms_g_2019_0025.jpg
8961,Microscope thin section of a quartz rich Cambrian sandstone known locally as Wrekin Quartzite.,Quartzite,"Chronostratigraphy, Lithostratigraphy",Cambrian Period,,https://data.nhm.ac.uk/media/ludlow:G.20543.002a.jpg; https://data.nhm.ac.uk/media/ludlow:G.20543.002b.jpg; https://data.nhm.ac.uk/media/ludlow:G.20543.002c.jpg; https://data.nhm.ac.uk/media/ludlow:G.20543.002d.jpg; https://data.nhm.ac.uk/media/ludlow:G.20543.002e.jpg
8883,Fossilised remains of numerous densly packed small brachiopods in a calcareous sandstone matrix.,Brachiopod,Chronostratigraphy,Silurian Period,BRACHIOPODA,https://data.nhm.ac.uk/media/ludlow:G.20432.jpg
7029,"Fossilised remains of the Ordovician gastropod Bellerophon sp. found at Upper Gilwern, Howey, Llandrindod Wells.",Gastropod,Chronostratigraphy,Ordovician Period,Bellerophon sp.,https://data.nhm.ac.uk/media/ludlow:G.04025.jpg
7052,"Fossilised fragment of phragmocone of the Ordovician cephalopod Orthoceras sp. found at Llanfawr Quarry, Llandrindod Wells",Cephalopod,Chronostratigraphy,Ordovician Period,Orthoceras sp.,https://data.nhm.ac.uk/media/ludlow:G.04236a.jpg; https://data.nhm.ac.uk/media/ludlow:G.04236b.jpg
6816,"Fossilised remains of thorax and pygidium of the Silurian trilobite Homalonotus knightii, found at Pant-y-llyn Hill.",Trilobite,Chronostratigraphy,Silurian Period,Homalonotus knightii,https://data.nhm.ac.uk/media/ludlow:G.02804.001.jpg
8962,Microscope thin section of a quartz rich Cambrian sandstone known locally as Wrekin Quartzite.,Quartzite,"Chronostratigraphy, Lithostratigraphy",Cambrian Period,,https://data.nhm.ac.uk/media/ludlow:G.20543.003a.jpg; https://data.nhm.ac.uk/media/ludlow:G.20543.003b.jpg; https://data.nhm.ac.uk/media/ludlow:G.20543.003c.jpg; https://data.nhm.ac.uk/media/ludlow:G.20543.003d.jpg; https://data.nhm.ac.uk/media/ludlow:G.20543.003e.jpg
8889,"Thin section of Comley sandstone, found at Comley.",Sandstone,Chronostratigraphy,Cambrian Period,,https://data.nhm.ac.uk/media/ludlow:G.20500.003a.jpg; https://data.nhm.ac.uk/media/ludlow:G.20500.003b.jpg; https://data.nhm.ac.uk/media/ludlow:G.20500.003c.jpg
6710,"Fossilised remains of the Silurian brachiopod, Atrypa reticularis found at Bringewood",Brachiopod,"Chronostratigraphy, Lithostratigraphy",Silurian Period,Atrypa reticularis,https://data.nhm.ac.uk/media/ludlow:G.00922.jpg
6932,Fossilised remains of a horse tooth from the Siwalik Hills of India.,Horse; Tooth,Chronostratigraphy,Cenozoic Era,Equus sp.,https://data.nhm.ac.uk/media/ludlow:G.03571a.jpg
6656,"Fossilised remains of the Silurian tabulate, compound coral, Heliolites interstinctus. Showing small circular corallites.",CORAL,"Chronostratigraphy, Lithostratigraphy",Silurian Period,Heliolites interstinctus,https://data.nhm.ac.uk/media/ludlow:G.00113a.jpg; https://data.nhm.ac.uk/media/ludlow:G.00113b.jpg
8891,"Microscope thin section of Carboniferous Dolorite, also known as Dhustone. Found at Clee Hill.",,Chronostratigraphy,Carboniferous Period,,https://data.nhm.ac.uk/media/ludlow:G.20501.002a.jpg; https://data.nhm.ac.uk/media/ludlow:G.20501.002b.jpg; https://data.nhm.ac.uk/media/ludlow:G.20501.002c.jpg; https://data.nhm.ac.uk/media/ludlow:G.20501.002d.jpg; https://data.nhm.ac.uk/media/ludlow:G.20501.002e.jpg
6660,"Fossilised shell remains of the Silurian brachiopod, Atrypa reticularis. Original Ludlow Natural History Society specimen.",Brachiopod,"Biostratigraphy, Chronostratigraphy",Silurian Period,Atrypa reticularis,https://data.nhm.ac.uk/media/ludlow:G.00133.jpg
7066,Fossilised shell remains of the Ordovician brachiopod Reuschella bilobata found at Acton Scott.,Brachiopod,"Chronostratigraphy, Lithostratigraphy",Ordovician Period,Reuschella bilobata,https://data.nhm.ac.uk/media/ludlow:G.04332.jpg
8968,Thin section of Precambrian Longmyndian Greywacke found at Bayston Hill,,Chronostratigraphy,Precambrian Eon,,https://data.nhm.ac.uk/media/ludlow:G.20548.002a.jpg; https://data.nhm.ac.uk/media/ludlow:G.20548.002b.jpg; https://data.nhm.ac.uk/media/ludlow:G.20548.002c.jpg; https://data.nhm.ac.uk/media/ludlow:G.20548.002d.jpg; https://data.nhm.ac.uk/media/ludlow:G.20548.002e.jpg
8896,"Thin section of Cardingmill grit; a sandstone, found at Church Stretton.",Sandstone,Chronostratigraphy,Precambrian Eon,,https://data.nhm.ac.uk/media/ludlow:G.20503.002a.jpg; https://data.nhm.ac.uk/media/ludlow:G.20503.002b.jpg; https://data.nhm.ac.uk/media/ludlow:G.20503.002c.jpg; https://data.nhm.ac.uk/media/ludlow:G.20503.002d.jpg; https://data.nhm.ac.uk/media/ludlow:G.20503.002e.jpg
6670,"Fossilised complete shell of the Silurian orthide brachiopod, Dalejina hybrida. The shell is symmetrical and equivalve and displays fine radial ribbing. Found at Builwas, Shropshire. Mounted on card with G.00171-00172 and G.00174.",Brachiopod,"Chronostratigraphy, Lithostratigraphy",Silurian Period,Dalejina hybrida,https://data.nhm.ac.uk/media/ludlow:G.00173.jpg
6723,"Fossilised remains of Goniophora cymbaeformis as well as the brachiopods Protochonetes ludloviensis and Orbiculoidea. Found on the Linney to Dinham Raod, Ludlow",BIVALVE,"Chronostratigraphy, Lithostratigraphy",Silurian Period,Goniophora cymbaeformis,https://data.nhm.ac.uk/media/ludlow:G.01587.jpg
6832,"Fossilised remains of pygidium of the Silurian trilobite Dalmanites myops found at Upper Millichope, Shropshire.",Trilobite,"Chronostratigraphy, Lithostratigraphy",Silurian Period,Dalmanites myops,https://data.nhm.ac.uk/media/ludlow:G.03077.jpg
6876,"Fossilized remains of headshield of the Silurian heterostracan fish Pteraspis sp. found at Devil's Hole, Morville",Fish,Chronostratigraphy,Silurian Period,Pteraspis sp.,https://data.nhm.ac.uk/media/ludlow:G.03311.jpg
8902,"Thin section of Cardingmill Grit, a sandstone, found at Batch Valley, All Stretton.",Sandstone,Chronostratigraphy,Precambrian Eon,,https://data.nhm.ac.uk/media/ludlow:G.20504.002a.jpg; https://data.nhm.ac.uk/media/ludlow:G.20504.002b.jpg; https://data.nhm.ac.uk/media/ludlow:G.20504.002c.jpg; https://data.nhm.ac.uk/media/ludlow:G.20504.002d.jpg; https://data.nhm.ac.uk/media/ludlow:G.20504.002e.jpg
6934,"Fossilised remains of tooth from an extinct species of horse. Found in the Siwalik Hills, India.",Horse; Tooth,"Biostratigraphy, Chronostratigraphy",Cenozoic Era,Equidae,https://data.nhm.ac.uk/media/ludlow:G.03573.jpg
6962,Fossilised fragments of Silurian graptolites Pristiograptus colonus found at Upper Millichope,Graptolite,"Chronostratigraphy, Lithostratigraphy",Silurian Period,Pristiograptus colonus,https://data.nhm.ac.uk/media/ludlow:G.03653.jpg
6848,"Fossilised remains of eight fragments of the phragmocone of the Silurian orthocone cephalopod, Orthoceras ludense. Position of the siphuncular foramen visible in fragments 1-3",Cephalopod,"Chronostratigraphy, Lithostratigraphy",Silurian Period,Orthoceras ludense,https://data.nhm.ac.uk/media/ludlow:G.03167.jpg
6883,"Fossilised remains of Devonian agnathan Pteraspis leathensis found at Yew Tree Dingle, Morville",Agnathan,Chronostratigraphy,Devonian Period,Pteraspis leathensis,https://data.nhm.ac.uk/media/ludlow:G.03351.jpg
8924,Thin section of Ordovician siltstone from the Mytton Flags.,Siltstone,Chronostratigraphy,Ordovician Period,,https://data.nhm.ac.uk/media/ludlow:G.20510.002a.jpg; https://data.nhm.ac.uk/media/ludlow:G.20510.002b.jpg; https://data.nhm.ac.uk/media/ludlow:G.20510.002c.jpg
6686,"Plastercast of a death assemblage of the Devonian bony, jawless fish, Hemicyclaspis murchisoni.Showing shovel shaped head shield and well defined scales.",Fish,"Biostratigraphy, Chronostratigraphy",Devonian Period,Hemicyclaspis murchisoni,https://data.nhm.ac.uk/media/ludlow:G.00216a.jpg; https://data.nhm.ac.uk/media/ludlow:G.00216b.jpg
6742,Fossilised shell remains of the Silurian gastropod Bellerophon sp. found at Amestry Quarry.,Gastropod,"Chronostratigraphy, Lithostratigraphy",Silurian Period,Bellerophon sp.,https://data.nhm.ac.uk/media/ludlow:G.01981.jpg
6997,"Fossilised remains of Carboniferous brachiopod, Buxtonia intermixta. Found at Coalbrookdale, Shropshire.",Brachiopod,Chronostratigraphy,Carboniferous Period,Buxtonia intermixta,https://data.nhm.ac.uk/media/ludlow:G.03839.jpg
6885,"Fossilised remains of the head shield of a Devonian agnathan, Pteraspis leathensis found at Yew Tree Dingle, Morville",Agnathan,Chronostratigraphy,Devonian Period,Pteraspis leathensis,https://data.nhm.ac.uk/media/ludlow:G.03359.jpg
8930,Microscope thin section of a crystaline Carboniferous limestone from Derbyshire. This specimen shows a good section through a crinoid.,Limestone,Chronostratigraphy,Carboniferous Period,,https://data.nhm.ac.uk/media/ludlow:G.20514.002a.jpg; https://data.nhm.ac.uk/media/ludlow:G.20514.002b.jpg; https://data.nhm.ac.uk/media/ludlow:G.20514.002c.jpg; https://data.nhm.ac.uk/media/ludlow:G.20514.002d.jpg; https://data.nhm.ac.uk/media/ludlow:G.20514.002e.jpg
7055,"Fossilised remains of Ordovician cricoconarida,Tentaculites anglicus; brachiopods, Sowerbyella sericea and Onniella sp. and Trilobite, Dalmanella sp. Found at Haywood Common, Soudley.",Cricoconarida; Brachiopod; Trilobite,Chronostratigraphy,Ordovician Period,Tentaculites anglicus; Sowerbyella sericea; Onniella sp.; Dalmanella sp.,https://data.nhm.ac.uk/media/ludlow:G.04252.jpg
6977,"Fossilised remains of the Silurian stromatoporoid, Labechia conferta, found at Wenlock Edge.",Stromatoporoid,"Chronostratigraphy, Lithostratigraphy",Silurian Period,Labechia conferta,https://data.nhm.ac.uk/media/ludlow:G.03752.jpg
6909,Fossilised specimen of Ludlow Bone Bed with numerous course fragmentary fossils.,Ludlow Bone Bed,"Chronostratigraphy, Lithostratigraphy",Silurian Period,,https://data.nhm.ac.uk/media/ludlow:G.03490.jpg
8963,Microscope thin section of a quartz rich Cambrian sandstone known locally as Wrekin Quartzite.,Quartzite,"Chronostratigraphy, Lithostratigraphy",Cambrian Period,,https://data.nhm.ac.uk/media/ludlow:G.20543.004a.jpg; https://data.nhm.ac.uk/media/ludlow:G.20543.004b.jpg; https://data.nhm.ac.uk/media/ludlow:G.20543.004c.jpg; https://data.nhm.ac.uk/media/ludlow:G.20543.004d.jpg; https://data.nhm.ac.uk/media/ludlow:G.20543.004e.jpg
6935,"Fossilised remains of horse tooth in a fragment of lower jaw, from the Siwalik Hills of India.",Horse; Tooth,Chronostratigraphy,Cenozoic Era,Equus sp.,https://data.nhm.ac.uk/media/ludlow:G.03574.jpg
7090,"Fossilised remains of the Ordovician brachiopod Dinorthis flabellum, consisting of the internal mould of a single valve and fragments of others,  found at Pont Derwlwyn",Brachiopod,Chronostratigraphy,Ordovician Period,Dinorthis flabellum,https://data.nhm.ac.uk/media/ludlow:G.04580.jpg
6651,"An internal mould of one valve of the Ordoivician articulate brachiopod,  Dalmanella unguis found at Marshwood, Shropshire. Counterpart of G.00055.001. Original Ludlow Natural History Society specimen.",Brachiopod,"Chronostratigraphy, Lithostratigraphy",Ordovician Period,Dalmanella unguis,https://data.nhm.ac.uk/media/ludlow:G.00055.002.jpg
6662,"Fossilised remains of the Silurian brachiopod, Salopina lunata, found at Whitcliffe. Original Ludlow Natural History Society specimen collected by Lightbody.",Brachiopod,Chronostratigraphy,Silurian Period,Salopina lunata,https://data.nhm.ac.uk/media/ludlow:G.00145.jpg
6702,Fossilised shell remains of the Silurian brachiopod Amphistrophia funiculata found at Bringewood,Brachiopod,"Chronostratigraphy, Lithostratigraphy",Silurian Period,Amphistrophia funiculata,https://data.nhm.ac.uk/media/ludlow:G.00471.jpg
6978,Fossilised remains of the Silurian coral Halysites catenularis,CORAL,"Chronostratigraphy, Lithostratigraphy",Silurian Period,Halysites catenularis,https://data.nhm.ac.uk/media/ludlow:G.03754a.jpg
8911,Thin section of Silurian Much Wenlock Limestone found at Wenlock Edge.,Limestone,Chronostratigraphy,Silurian Period,,https://data.nhm.ac.uk/media/ludlow:G.20505.009a.jpg; https://data.nhm.ac.uk/media/ludlow:G.20505.009b.jpg; https://data.nhm.ac.uk/media/ludlow:G.20505.009c.jpg; https://data.nhm.ac.uk/media/ludlow:G.20505.009d.jpg; https://data.nhm.ac.uk/media/ludlow:G.20505.009e.jpg
7034,"Fossilised remains of the Ordovician trilobite Trinucleus fimbriatus founmd at Llanfawr Quarry, Llandrindod Wells.",Trilobite,Chronostratigraphy,Ordovician Period,Trinucleus fimbriatus,https://data.nhm.ac.uk/media/ludlow:G.04071.jpg
6665,"Fossilised remains of an almost complete shell of the Silurian brachiopod, Kirkidium knightii.",Brachiopod,"Chronostratigraphy, Lithostratigraphy",Silurian Period,Kirkidium knightii,https://data.nhm.ac.uk/media/ludlow:G.00148.jpg
7070,"Fossilised fragment of guard from the Cretaceous belemnite, Belemnitella mucronata. The guard is conical in form and possesses a conical alveolus. Mounted on card with five other specimens.",Belemnite,Chronostratigraphy,Cretaceous Period,Belemnitella mucronata,https://data.nhm.ac.uk/media/ludlow:G.04425.001.jpg
6767,"Fossilised fragment of phragmocone of the Silurian cephalopod, Orthoceras ludense, showing clearly defined suture lines.",Cephalopod,Chronostratigraphy,Silurian Period,Orthoceras ludense,https://data.nhm.ac.uk/media/ludlow:G.02172.jpg
8944,Microscope thin section of Precambrian Rushton Schist. Found at Rushton.,Schist,Chronostratigraphy,Precambrian Eon,,https://data.nhm.ac.uk/media/ludlow:G.20524.002a.jpg; https://data.nhm.ac.uk/media/ludlow:G.20524.002b.jpg; https://data.nhm.ac.uk/media/ludlow:G.20524.002c.jpg; https://data.nhm.ac.uk/media/ludlow:G.20524.002d.jpg; https://data.nhm.ac.uk/media/ludlow:G.20524.002e.jpg; https://data.nhm.ac.uk/media/ludlow:G.20524.002f.jpg; https://data.nhm.ac.uk/media/ludlow:G.20524.002g.jpg
6914,"Fossilised remains of the ventral shield of the Devonian fish Phialaspis symondsi found at Devil's Hole, Morville, Shropshire.",Fish,Chronostratigraphy,Devonian Period,Phialaspis symondsi,https://data.nhm.ac.uk/media/ludlow:G.03527.001.jpg
8985,Microscope thin section made from a hand specimen of sandstone from Grinshill.,Sandstone,Chronostratigraphy,Triassic Period,,https://data.nhm.ac.uk/media/ludlow:G.20551.012a.jpg; https://data.nhm.ac.uk/media/ludlow:G.20551.012b.jpg; https://data.nhm.ac.uk/media/ludlow:G.20551.012c.jpg; https://data.nhm.ac.uk/media/ludlow:G.20551.012d.jpg; https://data.nhm.ac.uk/media/ludlow:G.20551.012e.jpg
6959,Fossilised shell remains of Silurian bivalve Cardiola striata found at Mary Knoll.,BIVALVE,Chronostratigraphy,Silurian Period,Cardiola striata,https://data.nhm.ac.uk/media/ludlow:G.03647.jpg
7093,"Fossilised remains of the Ordovician brachiopods Dalmanella horderleyensis. Fragments of shell and internal moulds of single valves in a course sandy matrix. Found at Horderley, Shropshire.",Brachiopod,Chronostratigraphy,Ordovician Period,Dalmanella horderleyensis,https://data.nhm.ac.uk/media/ludlow:G.04595.jpg
8966,Microscope thin section of a quartz rich Cambrian sandstone known locally as Wrekin Quartzite.,Quartzite,"Chronostratigraphy, Lithostratigraphy",Cambrian Period,,https://data.nhm.ac.uk/media/ludlow:G.20543.007a.jpg; https://data.nhm.ac.uk/media/ludlow:G.20543.007b.jpg; https://data.nhm.ac.uk/media/ludlow:G.20543.007c.jpg; https://data.nhm.ac.uk/media/ludlow:G.20543.007d.jpg; https://data.nhm.ac.uk/media/ludlow:G.20543.007e.jpg
7042,"Fossilised shell remains of a single valve of the Silurian bivalve, Cardiola interupta. Marked radial ribbing and concentric growth lines visible. Counterpart to G.04116.002. Mounted on card. Found near Mary Knoll House, Ludlow.",BIVALVE,"Chronostratigraphy, Lithostratigraphy",Silurian Period,Cardiola interupta,https://data.nhm.ac.uk/media/ludlow:G.04116.001.jpg
7002,"Fossilised remains of the internal mould of the Jurassic ammonite, Amoeboceras sp. The shell is compressed and involute and possesses a deep umbilicus. The shell is deeply etched, revealing ammonitic suture. A derived fossil from the Jurassic Ampthill Clay and collected from the Lowestoft Till.",AMMONITE,Chronostratigraphy,Jurassic Period,amoeboceras (prionodoceras) s.p.,https://data.nhm.ac.uk/media/ludlow:G.03864.jpg
7074,"Fossilised fragment of guard of the Cretaceous belemnite, Belemnitella mucronata. The guard is conical in form and possesses a conical alveolus. Mounted on card with five other specimens.",Belemnite,Chronostratigraphy,Cretaceous Period,Belemnitella mucronata,https://data.nhm.ac.uk/media/ludlow:G.04425.005.jpg
6984,Fossilised shell remains of the Silurian bivalve Goniophora cymbaeformis.,BIVALVE,"Chronostratigraphy, Lithostratigraphy",Silurian Period,Goniophora cymbaeformis,https://data.nhm.ac.uk/media/ludlow:G.03790.001.jpg
6668,"Fossilised complete shell of the Silurian orthide brachiopod, Dalejina hybrida. The shell is symmetrical and equivalved and displays fine radial ribbing. Found at Buildwas, Shropshire. Mounted on card with G.00172-G.00174",Brachiopod,"Chronostratigraphy, Lithostratigraphy",Silurian Period,Dalejina hybrida,https://data.nhm.ac.uk/media/ludlow:G.00171.jpg
6661,"An assembledge of fossilised shell valves and moulds of the Silurian brachiopod, Microsphaeridiorhynchus nucula. An original Ludlow Natural History Society specimen. From Whitelciffe, Ludlow",Brachiopod,Chronostratigraphy,Silurian Period,Microsphaeridiorhynchus nucula,https://data.nhm.ac.uk/media/ludlow:G.00143.jpg
6891,"Fossilised remains of bone bed containing Silurian fish fragments including scales, bone and spine. Found at Onibury, Shropshire.",Fish,"Chronostratigraphy, Lithostratigraphy",Silurian Period,PISCES,https://data.nhm.ac.uk/media/ludlow:G.03395.jpg
