fossil_id,description,object_name,period,taxonomy,url,local_path
7844,"Fossilised shell remains of the Silurian bivalve Fuchsella amygdalina found in Mortimer Forest, Ludlow.",BIVALVE,Silurian Period,Fuchsella amygdalina,https://data.nhm.ac.uk/media/ludlow:G.11878.jpg,images/7844_Silurian_Period_BIVALVE.jpg
7707,"Fossilised remains of headshield of the Silurian cephalaspid fish Sclerodus cornua found on Bradnor Hill, Welsh Border.",Fish,Silurian Period,Sclerodus cornua,https://data.nhm.ac.uk/media/ludlow:G.09954.001a.jpg,images/7707_Silurian_Period_Fish.jpg
8675,"Sectioned and polished Jurassic ammonite, showing internal structure with infilled chambers.",AMMONITE,Jurassic Period,,https://data.nhm.ac.uk/media/ludlow:G.20205a.jpg,images/8675_Jurassic_Period_AMMONITE.jpg
8670,"Fossilised shell remains of the Jurassic gastropod Pseudomelania heddingtonensis, found in Wiltshire.",Gastropod,Jurassic Period,Pseudomelania heddingtonensis,https://data.nhm.ac.uk/media/ludlow:G.20198.jpg,images/8670_Jurassic_Period_Gastropod.jpg
8655,Fossilised shell remains of the Jurassic bivalve Gryphaea sp.,BIVALVE,Jurassic Period,Gryphaea sp.,https://data.nhm.ac.uk/media/ludlow:G.20184a.jpg,images/8655_Jurassic_Period_BIVALVE.jpg
7714,"Fossilised remains of a spine of ""spiny shark"" fish. Found at Landslip site, Cusop.",Fish,Silurian Period,Ischnacanthid,https://data.nhm.ac.uk/media/ludlow:G.09962.001a.jpg,images/7714_Silurian_Period_Fish.jpg
9139,"Fossil graptolite, Monograptus becki from the Silurian Pentamerus Beds of Harper's Dingle, Shropshire. Presented by Dr. W.F. Whittard.",Graptolite,Silurian Period,Monograptus becki,https://data.nhm.ac.uk/media/ludlow:shyms_g_1977_0149.jpg,images/9139_Silurian_Period_Graptolite.jpg
8958,Microscope thin section of an Ordovician volcanic ash found at Middletown Hill Quarry.,Ash,Ordovician Period,,https://data.nhm.ac.uk/media/ludlow:G.20533.002a.jpg,images/8958_Ordovician_Period_Ash.jpg
9017,Microscope thin section made from a specimen of sandstone found at Redhill Road Cliffs.,Sedimentary Rock,Permian Period,Sandstone,https://data.nhm.ac.uk/media/ludlow:G.20569.002a.jpg,images/9017_Permian_Period_Sedimentary_Rock.jpg
7858,Fossilised shell remains of the Silurian gastropod  Poleumita discors found at Wenlock Edge.,Gastropod,Silurian Period,Poleumita discors,https://data.nhm.ac.uk/media/ludlow:G.11987a.jpg,images/7858_Silurian_Period_Gastropod.jpg
8053,"A single, strongly convex valve of the Carboniferous productid brachiopod, Daviesiella llangollensis. Fine radial ribbing present. Mounted on card.",Brachiopod,Carboniferous Period,Daviesiella llangollensis,https://data.nhm.ac.uk/media/ludlow:G.13312.jpg,images/8053_Carboniferous_Period_Brachiopod.jpg
8937,Microscope thin section of a hand specimen taken from the Stapeley Volcanics. Found at Stapeley.,Stapeley Volcanics,Ordovician Period,,https://data.nhm.ac.uk/media/ludlow:G.20517.002a.jpg,images/8937_Ordovician_Period_Stapeley_Volcanics.jpg
8719,Fossilised shell remains of the Cretaceous bivalve Inoceramus crippsi found on the Isle of Wight,BIVALVE,Cretaceous Period,Inoceramus crippsi,https://data.nhm.ac.uk/media/ludlow:G.20250.jpg,images/8719_Cretaceous_Period_BIVALVE.jpg
8682,"Fossilised guard of the Jurassic belemnite, Belemnites sp. The guard is bullet shaped, tapering towards the posterior end. A small portion of the chambered phragmocone is preserved at the anterior end.",Belemnite,Jurassic Period,Belemnites sp.,https://data.nhm.ac.uk/media/ludlow:G.20213.jpg,images/8682_Jurassic_Period_Belemnite.jpg
8926,Microscope thin section of Meadowtown Limestone.,Limestone,Ordovician Period,,https://data.nhm.ac.uk/media/ludlow:G.20511.002a.jpg,images/8926_Ordovician_Period_Limestone.jpg
7715,"Fossilised remains of spine of an Acanthodian fish. Found at Landslip site, Cusop.",Fish,Silurian Period,Acanthodii,https://data.nhm.ac.uk/media/ludlow:G.09962.002a.jpg,images/7715_Silurian_Period_Fish.jpg
8181,Fossilised remains of a Carboniferous annelid tracks found in the Wellington District.,Annelid,Carboniferous Period,,https://data.nhm.ac.uk/media/ludlow:G.14271.jpg,images/8181_Carboniferous_Period_Annelid.jpg
8735,Cretaceous fossil found on the Isle of White.,,Cretaceous Period,,https://data.nhm.ac.uk/media/ludlow:G.20262.jpg,images/8735_Cretaceous_Period_nan.jpg
9246,"Fossilised belemnite, Belemnites attenuata, from the Gault Clay. Found at Folkstone.",Belemnite,Cretaceous Period,Belemnites attenuata.,https://data.nhm.ac.uk/media/ludlow:shyms_g_2007_0011.jpg,images/9246_Cretaceous_Period_Belemnite.jpg
7861,"Fossilised shell of Silurian gastropod Loxonema gregaria, found at Stokesay, Shropshire.",Gastropod,Silurian Period,Loxonema gregaria,https://data.nhm.ac.uk/media/ludlow:G.11990a.jpg,images/7861_Silurian_Period_Gastropod.jpg
7720,Fossilised remains of phragmocone of the Silurian cephalopod Orthoceras sp. Spirobis and Bryozoan fossils are also present in the matrix. Found at Ludford Park.,Cephalopod,Silurian Period,Orthoceras sp.,https://data.nhm.ac.uk/media/ludlow:G.10005.jpg,images/7720_Silurian_Period_Cephalopod.jpg
9163,"Fossilised remains of the Ordovician ostracod, Primitia bicornis (Jones). Found at Cwms Plantation East, Church Stretton.",Ostracod,Ordovician Period,Primitia bicornis,https://data.nhm.ac.uk/media/ludlow:shyms_g_1977_0515.jpg,images/9163_Ordovician_Period_Ostracod.jpg
7909,Fossilised remains of the Silurian brachiopod Sphaerirhynchia wilsoni found in Mortimer Forest.,Brachiopod,Silurian Period,Sphaerirhynchia wilsoni,https://data.nhm.ac.uk/media/ludlow:G.12157.jpg,images/7909_Silurian_Period_Brachiopod.jpg
8943,Hand specimen of Precambrian Rushton Schist found at Rushton.,Schist,Precambrian Eon,,https://data.nhm.ac.uk/media/ludlow:G.20524.001.jpg,images/8943_Precambrian_Eon_Schist.jpg
7726,"Fossilised remains of the lower or distal end of a metatarsal of THE extinct giraffid, Sivatherium giganteum. Found in the Siwalik hills of India.",Giraffid; Metatarsal,Cenozoic Era,Sivatherium giganteum,https://data.nhm.ac.uk/media/ludlow:G.10034.jpg,images/7726_Cenozoic_Era_Giraffid;_Metatarsal.jpg
9181,"Fossilised shell remains of the Silurian brachiopod, Pentamerus knighti (Sow.) Found at Craven Arms, Shropshire.",Brachiopod,Silurian Period,Pentamerus knighti,https://data.nhm.ac.uk/media/ludlow:shyms_g_1977_0703.001.jpg,images/9181_Silurian_Period_Brachiopod.jpg
9061,Thin section of rhyolite found at Caer Caradoc.,Igneous Rock,Precambrian Eon,Rhyolite,https://data.nhm.ac.uk/media/ludlow:G.20613.002a.jpg,images/9061_Precambrian_Eon_Igneous_Rock.jpg
8666,"Fossilised shell of the Jurassic Bivalve, Macromya cardiodas. The shell is equivalve and asymmetric and shows fine concentric growth lines. The umbones are incurved. Mounted on card.",BIVALVE,Jurassic Period,Macromya cardiodas,https://data.nhm.ac.uk/media/ludlow:G.20193.jpg,images/8666_Jurassic_Period_BIVALVE.jpg
8748,Fossilised shell remains of either a planispiral Ordovician gastropod or a nautiloid. A fragment of an indeterminate trilobite is contained within the same rock matrix.,Gastropod; Trilobite,Ordovician Period,GASTROPODA; TRILOBITA,https://data.nhm.ac.uk/media/ludlow:G.20273.jpg,images/8748_Ordovician_Period_Gastropod;_Trilobite.jpg
8650,"A series of borings made by the Jurassic bivalve, Teredina personata (ship worm).The borings are circular in cross section and are within a Liassic? shale. Mounted on card.",Trace fossil,Jurassic Period,Teredina personata,https://data.nhm.ac.uk/media/ludlow:G.20178.jpg,images/8650_Jurassic_Period_Trace_fossil.jpg
7937,"Fossilised remains of the Carboniferous plant Alethopteri sp. Found at Ynysybwl, Glamorgan.",Plant,Carboniferous Period,Alethopteris sp.,https://data.nhm.ac.uk/media/ludlow:G.12320.jpg,images/7937_Carboniferous_Period_Plant.jpg
7874,"Fossilised remains of the Silurian Annelid Serpulites longissimus found by Price, L. at Downton Castle.",Annelid,Silurian Period,Sphenothallus sp.,https://data.nhm.ac.uk/media/ludlow:G.12020a.jpg,images/7874_Silurian_Period_Annelid.jpg
8090,"Fossilised remains of the Ordovician brachiopods Sowerbyella sericea and Dalmanella horderleyensis. Preserved as internal and external moulds of disarticulated valves. Found by Baker, H. at Horderley.",Brachiopod,Ordovician Period,Sowerbyella sericea; Dalmanella horderleyensis,https://data.nhm.ac.uk/media/ludlow:G.13651.jpg,images/8090_Ordovician_Period_Brachiopod.jpg
8652,"Fossilised shell remains of the Jurassic bivalve Pseudopecten equivalvis. Also in the matrix is a fossiled belemnite. Found near Prees, Shropshire.",BIVALVE; Belemnite,Jurassic Period,Pseudopecten equivalvis; Belemnitida,https://data.nhm.ac.uk/media/ludlow:G.20180.jpg,images/8652_Jurassic_Period_BIVALVE;_Belemnite.jpg
9013,Microscope thin section of porphyritic basalt made from a hand specimen collected from a dyke at Grinshill Quarry.,Igneous Rock,Cenozoic Era,Basalt,https://data.nhm.ac.uk/media/ludlow:G.20566.005a.jpg,images/9013_Cenozoic_Era_Igneous_Rock.jpg
8751,"Fossilised shell remains of the Eocene gastropod, Sycostoma pyrus found on Barton Cliff, Hampshire.",Gastropod,Cenozoic Era,Sycostoma pyrus,https://data.nhm.ac.uk/media/ludlow:G.20280.jpg,images/8751_Cenozoic_Era_Gastropod.jpg
7882,"Fossilised shell remains of the Silurian bivalve, Cardiola interrupta, found in the Ludlow district.",BIVALVE,Silurian Period,Cardiola interrupta,https://data.nhm.ac.uk/media/ludlow:G.12040.jpg,images/7882_Silurian_Period_BIVALVE.jpg
8768,"Fossilised exoskeletons of the Ordovician trilobite, Cnemidopyge bisecta. The glabella on the complete exoskeleton possesses a distinctive ridge. Found at Penybont, Powys. Identified by Botting and Muir Feb. 2017.",Trilobite,Ordovician Period,Cnemidopyge bisecta,https://data.nhm.ac.uk/media/ludlow:G.20302.jpg,images/8768_Ordovician_Period_Trilobite.jpg
8770,"Greenish-coloured Cambrian sandstone from Comley Quarry, Shropshire.",Sandstone,Cambrian Period,,https://data.nhm.ac.uk/media/ludlow:G.20304.jpg,images/8770_Cambrian_Period_Sandstone.jpg
8957,Hand specimen of an Ordovician volcanic ash found at Middletown Hill Quarry.,Ash,Ordovician Period,,https://data.nhm.ac.uk/media/ludlow:G.20533.001.jpg,images/8957_Ordovician_Period_Ash.jpg
8106,"Fossilised remains of a Silurian polychaete worm found at Buildwas, Shropshire.",Worm,Silurian Period,Polychaeta,https://data.nhm.ac.uk/media/ludlow:G.13727.jpg,images/8106_Silurian_Period_Worm.jpg
9215,"Fossilised remains of head shield of the Carboniferous fish Megalichthys sp. Found at Coalbrookdale, Shropshire.",Fish,Carboniferous Period,Megalichthys sp.,https://data.nhm.ac.uk/media/ludlow:shyms_g_1982_075.002a.jpg,images/9215_Carboniferous_Period_Fish.jpg
8774,Fossilised shell remains of the Eocene bivalve Chama squamosa.,BIVALVE,Cenozoic Era,Chama squamosa,https://data.nhm.ac.uk/media/ludlow:G.20312.jpg,images/8774_Cenozoic_Era_BIVALVE.jpg
8696,Fossilised shell remains of a Cretaceous ammonite.,AMMONITE,Cretaceous Period,CEPHALOPODA,https://data.nhm.ac.uk/media/ludlow:G.20231.jpg,images/8696_Cretaceous_Period_AMMONITE.jpg
7755,"Fossilised fragment of phragmocone of an Ordovician cephalopod, Orthoceras sp. Found near Marshbrook.",Cephalopod,Ordovician Period,Orthoceras sp.,https://data.nhm.ac.uk/media/ludlow:G.10295.jpg,images/7755_Ordovician_Period_Cephalopod.jpg
8663,"A fragment of one valve of the Jurassic Bivalve, Gresslya intermedia.",BIVALVE,Jurassic Period,Gresslya intermedia,https://data.nhm.ac.uk/media/ludlow:G.20191.001.jpg,images/8663_Jurassic_Period_BIVALVE.jpg
9030,"Microscope thin section of Criggion Dolerite, made from a hand specimen collected at Criggion.",Igneous Rock,Ordovician Period,Dolerite,https://data.nhm.ac.uk/media/ludlow:G.20571.007a.jpg,images/9030_Ordovician_Period_Igneous_Rock.jpg
8784,"Fossilised shell remains of a Teritiary gastropod found in grey fine clay, Water Lane, Walford.",Gastropod,Cenozoic Era,GASTROPODA,https://data.nhm.ac.uk/media/ludlow:G.20317.005.jpg,images/8784_Cenozoic_Era_Gastropod.jpg
8706,A near complete shell of an indeterminate Cretaceous Bivalve. The shell is equivalved and inequilateral. One valve possesses an inwardly curved umbone. The concentric growth lines are pronounced and ridged.,BIVALVE,Cretaceous Period,BIVALVIA,https://data.nhm.ac.uk/media/ludlow:G.20247a.jpg,images/8706_Cretaceous_Period_BIVALVE.jpg
7756,Fossilised remains of tooth of the Devonian Coelacanth Crossopterygii,Fish,Devonian Period,Crossopterygii,https://data.nhm.ac.uk/media/ludlow:G.10305.001a.jpg,images/7756_Devonian_Period_Fish.jpg
9237,"Fossil Trilobite, Ordovician period, found at Onny River Section. Presented to Shrewsbury Museum by R.A. Buddicom Esq.",Trilobite,Ordovician Period,Onnia superba,https://data.nhm.ac.uk/media/ludlow:shyms_g_1994_0333.jpg,images/9237_Ordovician_Period_Trilobite.jpg
9166,"Fossilised shell remains of the Silurian gastropod, Poleumita globosa (Schlotheim). Found on Wenlock Edge, Shropshire.",Gastropod,Silurian Period,Poleumita globosa,https://data.nhm.ac.uk/media/ludlow:shyms_g_1977_0585.001.jpg,images/9166_Silurian_Period_Gastropod.jpg
7889,"Fossilised shell remains of the Silurian brachiopod Camarotoechia borealis found on Wenlock Edge, Shropshire.",Brachiopod,Silurian Period,Camarotoechia borealis,https://data.nhm.ac.uk/media/ludlow:G.12086.001.jpg,images/7889_Silurian_Period_Brachiopod.jpg
8793,Course-grained red coloured sandstone. Collected at Powis Castle.,Sedimentary Rock,Devonian Period,,https://data.nhm.ac.uk/media/ludlow:G.20330a.jpg,images/8793_Devonian_Period_Sedimentary_Rock.jpg
9019,"Microscope thin section of Criggion Dolerite, made from a hand specimen collected at Criggion.",Igneous Rock,Ordovician Period,Dolerite,https://data.nhm.ac.uk/media/ludlow:G.20570.003a.jpg,images/9019_Ordovician_Period_Igneous_Rock.jpg
8796,"A fine grained, buff coloured sandstone, with occaisional well rounded pebbly clasts.",Sandstone,Cambrian Period,,https://data.nhm.ac.uk/media/ludlow:G.20333a.jpg,images/8796_Cambrian_Period_Sandstone.jpg
8802,Course grained ferruginous sandstone; Kenley Grit. Found at roadside quarry near Church Preen.,Kenley Grit,Silurian Period,Sandstone,https://data.nhm.ac.uk/media/ludlow:G.20339b.jpg,images/8802_Silurian_Period_Kenley_Grit.jpg
7891,"Fossilised shell remains of the Silurian brachiopod Camarotoechia borealis found at Wren's Nest, Dudley.",Brachiopod,Silurian Period,Camarotoechia borealis,https://data.nhm.ac.uk/media/ludlow:G.12091.001a.jpg,images/7891_Silurian_Period_Brachiopod.jpg
7779,"Fossilised shell remains of an indeterminate planispiral gastropod from the Ordovician Period, Lllanvirn Series. Found at Nind Quarry. Counterpart with G.10525.001",Gastropod,Ordovician Period,GASTROPODA,https://data.nhm.ac.uk/media/ludlow:G.10525.002.jpg,images/7779_Ordovician_Period_Gastropod.jpg
9241,Pygidium of the Ordovician trilobite Onnia superba. Found at Onny River Section. Presented to Shrewsbury Museum by R.A. Buddicom Esq.,Trilobite,Ordovician Period,Onnia superba,https://data.nhm.ac.uk/media/ludlow:shyms_g_1994_0341.jpg,images/9241_Ordovician_Period_Trilobite.jpg
9064,"Dark, weathered amygdaloidal with infilled vesicles. Found on the Lawley, Shropshire.",Igneous Rock,Precambrian Eon,Andesite,https://data.nhm.ac.uk/media/ludlow:G.30001.jpg,images/9064_Precambrian_Eon_Igneous_Rock.jpg
7906,Fossilised remains of the Ordovician trilobite Trinucleus sp. found at Bushmoor.,Trilobite,Ordovician Period,Trinucleus sp.,https://data.nhm.ac.uk/media/ludlow:G.12141.001.jpg,images/7906_Ordovician_Period_Trilobite.jpg
8804,Piece of coarse grained Lydebrook sandstone. Effectively a conglomerate containing pebbles of Cambrian quartzite and ercallite.,Sedimentary Rock,Carboniferous Period,Conglomerate,https://data.nhm.ac.uk/media/ludlow:G.20341.jpg,images/8804_Carboniferous_Period_Sedimentary_Rock.jpg
9026,"Microscope thin section of Criggion Dolerite, made from a hand specimen collected at Criggion.",Igneous Rock,Ordovician Period,Dolerite,https://data.nhm.ac.uk/media/ludlow:G.20571.003a.jpg,images/9026_Ordovician_Period_Igneous_Rock.jpg
8975,Microscope thin section made from a hand specimen of sandstone from Grinshill.,Sandstone,Triassic Period,,https://data.nhm.ac.uk/media/ludlow:G.20551.002a.jpg,images/8975_Triassic_Period_Sandstone.jpg
7789,Partially fossilised mandible of the youngest of the juvenile Shropshire mammoths. Found at Condover quarry during excavations. Dated to approximately 14000 years bp.,Woolly mammoth,Cenozoic Era,Mammuthus primigenius,https://data.nhm.ac.uk/media/ludlow:G.10724.002a.jpg,images/7789_Cenozoic_Era_Woolly_mammoth.jpg
8690,Fossillised remains of the Jurassic boney fish Dapedium.,Fish,Jurassic Period,Dapedium,https://data.nhm.ac.uk/media/ludlow:G.20222.jpg,images/8690_Jurassic_Period_Fish.jpg
9189,"Fossilised remains of shells of the Silurian gastropod, Platyschisma helicites (Sow.)",Gastropod,Silurian Period,Platyschisma helicites,https://data.nhm.ac.uk/media/ludlow:shyms_g_1977_0750.001.jpg,images/9189_Silurian_Period_Gastropod.jpg
8988,Microscope thin section made from a hand specimen of sandstone from Grinshill.,Sandstone,Triassic Period,,https://data.nhm.ac.uk/media/ludlow:G.20551.015a.jpg,images/8988_Triassic_Period_Sandstone.jpg
9243,Fossilised shell remains of the Ordovician brachiopod Resserella paracyclica found at Gretton.,Brachiopod,Ordovician Period,Resserella paracyclica,https://data.nhm.ac.uk/media/ludlow:shyms_g_1994_0395.jpg,images/9243_Ordovician_Period_Brachiopod.jpg
9192,"Sample of Precambrian igneous rock, Amygdaloidal Bostonite. Found on Caer Caradoc, Shropshire.",Igneous Rock,Precambrian Eon,,https://data.nhm.ac.uk/media/ludlow:shyms_g_1977_0806.jpg,images/9192_Precambrian_Eon_Igneous_Rock.jpg
7914,"Parts of  the Silurian fossil brachiopods, Pentamerus oblongus, Eocoelia curtisi and  Leptaena lobata also cricoconarida, Tentaculites sp. found at Norbury",Brachiopod,Silurian Period,Pentamerus oblongus; Eocoelia curtisi; Leptaena lobata; Tentaculites sp.,https://data.nhm.ac.uk/media/ludlow:G.12201a.jpg,images/7914_Silurian_Period_Brachiopod.jpg
9210,"Fossilised remains of headshield of the Devonian jawless fish Pteraspis sp. found at Morville, Shropshire.",Fish,Devonian Period,Pteraspis sp.,https://data.nhm.ac.uk/media/ludlow:shyms_g_1982_052.jpg,images/9210_Devonian_Period_Fish.jpg
9007,Microscope thin section of sandstone made from a hand specimen collected at Soudley.,Sandstone,Ordovician Period,,https://data.nhm.ac.uk/media/ludlow:G.20563.003a.jpg,images/9007_Ordovician_Period_Sandstone.jpg
7800,"Fossilised remains of a complete exoskeleton of Ordovician trilobite, Flexiycalymene sp., Found at Meifod, Powys",Trilobite,Ordovician Period,Flexiycalymene sp.,https://data.nhm.ac.uk/media/ludlow:G.11215a.jpg,images/7800_Ordovician_Period_Trilobite.jpg
9249,Silurian assemblage found on Wenlock Edge,Assemblage,Silurian Period,,https://data.nhm.ac.uk/media/ludlow:shyms_g_2013_0003.jpg,images/9249_Silurian_Period_Assemblage.jpg
8052,"Fossilised remains of one valve of the Carboniferous articulate brachiopod, Gigantoproductus giganteus, found at Penygraig, Froncyllte. Specimen shows strong radial ribbing.",Brachiopod,Carboniferous Period,Gigantoproductus giganteus,https://data.nhm.ac.uk/media/ludlow:G.13307.jpg,images/8052_Carboniferous_Period_Brachiopod.jpg
9214,"Fossilised remains of head shield of the Carboniferous fish Megalichthys sp. Found at Coalbrookdale, Shropshire.",Fish,Carboniferous Period,Megalichthys sp.,https://data.nhm.ac.uk/media/ludlow:shyms_g_1982_075.001.jpg,images/9214_Carboniferous_Period_Fish.jpg
8763,"Fossilised shell remains of the Cenozoic gastropod, Cerithium sedgwickii. Part of the Charles Ashford Collection.",Gastropod,Cenozoic Era,Cerithium sedgwickii,https://data.nhm.ac.uk/media/ludlow:G.20295.003.jpg,images/8763_Cenozoic_Era_Gastropod.jpg
8147,Fossilised shell remains of the Ordovician brachiopod Bicuspina spiriferoides found at Marshbrook.,Brachiopod,Ordovician Period,Bicuspina spiriferoides,https://data.nhm.ac.uk/media/ludlow:G.14096.jpg,images/8147_Ordovician_Period_Brachiopod.jpg
8739,"Fossilised right valve of the Pliocene bivalve, Pecten coalingensis. The valve is almost equilateral and possesses a pronounced 'ear' on each side of the umbo. Mounted on card. Found in the Kettlemon Hills, California.",BIVALVE,Cenozoic Era,Pecten coalingensis,https://data.nhm.ac.uk/media/ludlow:G.20264.jpg,images/8739_Cenozoic_Era_BIVALVE.jpg
8056,"Fossilised remains of the Carboniferous brachiopod Spinifer sp. found in County Fermanagh, Ireland",Brachiopod,Carboniferous Period,Spirifer sp.,https://data.nhm.ac.uk/media/ludlow:G.13355.jpg,images/8056_Carboniferous_Period_Brachiopod.jpg
8881,"Assemblage of Silurian brachiopods, bryozoa and trilobite fragments, including Dolerorthis rustica. Found at Wren's Nest.",Brachiopod,Silurian Period,Dolerorthis rustica,https://data.nhm.ac.uk/media/ludlow:G.20430a.jpg,images/8881_Silurian_Period_Brachiopod.jpg
9014,Microscope thin section of porphyritic basalt made from a hand specimen collected from a dyke at Grinshill Quarry.,Igneous Rock,Cenozoic Era,Basalt,https://data.nhm.ac.uk/media/ludlow:G.20566.006a.jpg,images/9014_Cenozoic_Era_Igneous_Rock.jpg
8864,Fossilised remains of a non-calcified alga. Similar appearance to Inocaulis.,Plant,Silurian Period,,https://data.nhm.ac.uk/media/ludlow:G.20406a.jpg,images/8864_Silurian_Period_Plant.jpg
9262,"Ironstone nodule from the Carboniferous of Shropshire, containing the fossil of a shark egg case, Palaeoxyris. The specimen bears resemblance to lycopod plant remains.",Plant,Carboniferous Period,Palaeoxyris helicteroides,https://data.nhm.ac.uk/media/ludlow:shyms_g_2019_0027.jpg,images/9262_Carboniferous_Period_Plant.jpg
8782,"Fossilised shell remains of a Teritiary gastropod found in grey fine clay, Water Lane, Walford.",Gastropod,Cenozoic Era,GASTROPODA,https://data.nhm.ac.uk/media/ludlow:G.20317.003.jpg,images/8782_Cenozoic_Era_Gastropod.jpg
7818,"Fossilised remains of pygidium and thorax of the Silurian trilobite, Dalmanites myops. Found at Downto Gorge.",Trilobite,Silurian Period,Dalmanites myops,https://data.nhm.ac.uk/media/ludlow:G.11621.jpg,images/7818_Silurian_Period_Trilobite.jpg
8766,"Coarse-grained red coloured Devonian sandstone, locally called Cornstone. Found at Clee St.Margaret.",Sandstone,Devonian Period,,https://data.nhm.ac.uk/media/ludlow:G.20299.jpg,images/8766_Devonian_Period_Sandstone.jpg
8057,"Fossil remains of the Carboniferous compound rugose coral, Lithostrotion sp. with phaceloid coralla.",CORAL,Carboniferous Period,Lithostrotion sp.,https://data.nhm.ac.uk/media/ludlow:G.13381a.jpg,images/8057_Carboniferous_Period_CORAL.jpg
9263,Ironstone nodule form the carboniferous of Shropshire containing the fossilised remains of a plant stem. The fossil preserves much of the three dimensional nature of the original plant structure. Found at Coalbrookdale.,Plant,Carboniferous Period,Plantae,https://data.nhm.ac.uk/media/ludlow:shyms_g_2019_0028.jpg,images/9263_Carboniferous_Period_Plant.jpg
9032,"Microscope thin section of sandstone, made from a hand specimen collected at Grinshill.",Igneous Rock,Triassic Period,Sandstone,https://data.nhm.ac.uk/media/ludlow:G.20572.002a.jpg,images/9032_Triassic_Period_Igneous_Rock.jpg
7819,"Fossilised remains of pygidium and thorax of the Silurian trilobite Dalmanites caudatus found at Buildwas, Shropshire.",Trilobite,Silurian Period,Dalmanites caudatus,https://data.nhm.ac.uk/media/ludlow:G.11637.jpg,images/7819_Silurian_Period_Trilobite.jpg
8915,Microscope thin section of Permian Bridgnorth Sandstone. Found at Bridgnorth.,Sandstone,Permian Period,,https://data.nhm.ac.uk/media/ludlow:G.20506.003a.jpg,images/8915_Permian_Period_Sandstone.jpg
7824,"Fossilised remains of thorax and pygidium of the Silurian triloibite Encrinurus punctatus found at Wrens Nest, Dudley.",Trilobite,Silurian Period,Encrinurus punctatus,https://data.nhm.ac.uk/media/ludlow:G.11728.jpg,images/7824_Silurian_Period_Trilobite.jpg
8989,Hand specimen of Precambrian Longmyndian Greywacke found at Bayston Hill.,,Precambrian Eon,,https://data.nhm.ac.uk/media/ludlow:G.20552.001.jpg,images/8989_Precambrian_Eon_nan.jpg
7992,"Fine-grained sandstone, Tarporley siltstone, with adhesion ripples which were formed by wind blowing over half-dry sand. Found at Grinshill Quarry.",Sandstone,Triassic Period,,https://data.nhm.ac.uk/media/ludlow:G.12914.jpg,images/7992_Triassic_Period_Sandstone.jpg
8876,"Assemblage of Silurian brachiopods including Dayia navicula, Atrypa reticularis  and Sphaerirhynchia wilsoni. Found at Mocktree Quarry.",Brachiopod,Silurian Period,Dayia navicula; Atrypa reticularis; Sphaerirhynchia wilsoni,https://data.nhm.ac.uk/media/ludlow:G.20425a.jpg,images/8876_Silurian_Period_Brachiopod.jpg
8772,Fossilised single shell valve of the Cenozoic bivalve Crassatella sulcata.,BIVALVE,Cenozoic Era,Crassatella sulcata,https://data.nhm.ac.uk/media/ludlow:G.20310.jpg,images/8772_Cenozoic_Era_BIVALVE.jpg
8866,"Fossilised remains of the sponge, Plectoderma sp. Contained within a fine grained silty sandstone and displaying a series of lines, representing growth development.",Sponge,Silurian Period,Plectoderma sp.,https://data.nhm.ac.uk/media/ludlow:G.20409a.jpg,images/8866_Silurian_Period_Sponge.jpg
8997,Microscope thin section of Carboniferous limestone. Made from a hand specimen collected at Llanymynech.,Limestone,Carboniferous Period,,https://data.nhm.ac.uk/media/ludlow:G.20555.004a.jpg,images/8997_Carboniferous_Period_Limestone.jpg
7998,Fossilised shell remains of the Silurian bivalve Orbiculoidea rugata found in the Leintwardine district,BIVALVE,Silurian Period,Orbiculoidea rugata,https://data.nhm.ac.uk/media/ludlow:G.13000a.jpg,images/7998_Silurian_Period_BIVALVE.jpg
9156,"Fossilised Ordovician brachiopod, Resserella canalis. Found at Folly Bank, Shropshire.",Brachiopod,Ordovician Period,Resserella canalis,https://data.nhm.ac.uk/media/ludlow:shyms_g_1977_0414.002.jpg,images/9156_Ordovician_Period_Brachiopod.jpg
