fossil_id,description,object_name,period,taxonomy,url,local_path
7648,"Fossilised remains of the Silurian sponge, Sporangium edwardsi. Found by Glaze, G. at Whitcliffe, Ludlow.",Sponge,Silurian Period,Sporangium edwardsi,https://data.nhm.ac.uk/media/ludlow:G.09547.jpg,images/7648_Silurian_Period_Sponge.jpg
8494,"Fossilised remains of the Silurian cephalopod, Orthoceras sp. and epizoac annelid tubes. Found near Dinham Bridge, Whitcliffe, Ludlow",Cephalopod,Silurian Period,Orthoceras sp.,https://data.nhm.ac.uk/media/ludlow:G.17875.jpg,images/8494_Silurian_Period_Cephalopod.jpg
8638,"Indeterminate plant remains from Easington, Co. Durham.",Plant,Carboniferous Period,,https://data.nhm.ac.uk/media/ludlow:G.20149.jpg,images/8638_Carboniferous_Period_Plant.jpg
7568,"Fossilised assenbledge of Silurian organisms including fragments of the trilobite Dalmanites myops, brachiopods, bryozoans, crinoid ossiles and other organisms. Found at Shadwell Quarry.",Trilobite; Brachiopod; Crinoid; Assembledge,Silurian Period,Dalmanites myops; BRACHIOPODA; CRINOIDEA; BRYOZOA,https://data.nhm.ac.uk/media/ludlow:G.08873.jpg,images/7568_Silurian_Period_Trilobite;_Brachiopod;_Crinoid;_Assembledge.jpg
7696,"Fossilised remains of part of a vertebra of an extinct species of elephant. Found in the Siwalik Hills, India.",Elephant; Vertebra,Cenozoic Era,Elephas,https://data.nhm.ac.uk/media/ludlow:G.09921a.jpg,images/7696_Cenozoic_Era_Elephant;_Vertebra.jpg
7435,Preserved head shield of the palaeozoic fish Europrotaspis sp. Found at The Gore.,Fish,Devonian Period,Europrotaspis sp.,https://data.nhm.ac.uk/media/ludlow:G.08127.002.jpg,images/7435_Devonian_Period_Fish.jpg
7563,"Fossilised remains of the Carboniferous Malacostracan crustacean Crangopsis sp. with Waterstonella grantonenisis found near Edinburgh, Scotland.",Crustacean,Carboniferous Period,Crangopsis sp.; Waterstonella grantonenisis,https://data.nhm.ac.uk/media/ludlow:G.08784.jpg,images/7563_Carboniferous_Period_Crustacean.jpg
8225,"Fossilised remains of part of the stem of Sigillaria, a carboniferous plant, found at Clee Hill.",Plant,Carboniferous Period,Sigillaria sp.,https://data.nhm.ac.uk/media/ludlow:G.14522.jpg,images/8225_Carboniferous_Period_Plant.jpg
8372,"Fossilised remains of Jurassic ammonite, Harpoceras sp. The shell is slightly evolute and is ornamented with 'sickle shaped' ribs. The underside of the specimen has the notation "" BRIDPORT Mr J. JONES""",AMMONITE,Jurassic Period,Harpoceras falciferum,https://data.nhm.ac.uk/media/ludlow:G.16043.jpg,images/8372_Jurassic_Period_AMMONITE.jpg
8212,Fossilised remains of Carboniferous pteridosperm Rhacopteris sp.,Pteridosperm,Carboniferous Period,Rhacopteris sp,https://data.nhm.ac.uk/media/ludlow:G.14457.jpg,images/8212_Carboniferous_Period_Pteridosperm.jpg
7567,"Fragment of the phragmocone of the Silurian cephalopod, Leurocycloceras whitcliffense. Showing septal foramen, centrally positioned on the septal surface.",Cephalopod,Silurian Period,Leurocycloceras whitcliffense,https://data.nhm.ac.uk/media/ludlow:G.08869.jpg,images/7567_Silurian_Period_Cephalopod.jpg
8492,"Silurian assemblage, principally composed of the brachiopod Microsphaeridiorhynchia nucula. Found by Smith, R.D.A. at Leintwardine.",Assemblage,Silurian Period,Microsphaeridiorhynchus nucula,https://data.nhm.ac.uk/media/ludlow:G.17846.jpg,images/8492_Silurian_Period_Assemblage.jpg
7371,"Fossilised remains of the calyx and arms of the Silurian fossil crinoid, Gissocrinus goniodactylus. Fragments of strophomenid and rhynchonellid brachiopods occur on the underside of the specimen.",Crinoid,Silurian Period,Gissocrinus goniodactylus,https://data.nhm.ac.uk/media/ludlow:G.07646a.jpg,images/7371_Silurian_Period_Crinoid.jpg
7594,Fossilised remains of the Silurian graptolite Pristiograptus sp. found in Stoke Wood.,Graptolite,Silurian Period,Pristiograptus sp.,https://data.nhm.ac.uk/media/ludlow:G.09052a.jpg,images/7594_Silurian_Period_Graptolite.jpg
8226,"Fossilised remains of part of the root of Stigmaria, a carboniferous lycopod.",Plant,Carboniferous Period,Stigmaria sp.,https://data.nhm.ac.uk/media/ludlow:G.14527a.jpg,images/8226_Carboniferous_Period_Plant.jpg
8346,"Fossilised remains of the lower jaw of an extinct type of elephant, from the Siwalik Hills of India.",Elephant; Jaw,Cenozoic Era,Elephantidae,https://data.nhm.ac.uk/media/ludlow:G.15229a.jpg,images/8346_Cenozoic_Era_Elephant;_Jaw.jpg
8238,"Fossilised remains of a single valve of the Ordovician bivalve Bysonychia sp. found at Soudly, Shropshire.",BIVALVE,Ordovician Period,Bysonychia sp.,https://data.nhm.ac.uk/media/ludlow:G.14597.002.jpg,images/8238_Ordovician_Period_BIVALVE.jpg
8370,Fossilised shell remains of the Silurian gastropod Poleumita sp.. Found at Farley Quarry.,Gastropod,Silurian Period,Poleumita sp.,https://data.nhm.ac.uk/media/ludlow:G.16001.jpg,images/8370_Silurian_Period_Gastropod.jpg
8379,"Rounded nodule containing the fossilised remains of numerous Jurassic ammonites. Found at Eardington, Bridgnorth.",AMMONITE,Jurassic Period,Ammonoidea,https://data.nhm.ac.uk/media/ludlow:G.16071.jpg,images/8379_Jurassic_Period_AMMONITE.jpg
8424,Grey green siltstone; brown on weathered surfaces.,Siltstone,Precambrian Eon,,https://data.nhm.ac.uk/media/ludlow:G.16518.001.jpg,images/8424_Precambrian_Eon_Siltstone.jpg
8495,"Silurian assemblage containing fossilised fragments of brachiopods, Salopina lunata, Microsphaeridiorhynchia nucula and Protochonetes ludloviensis. Found at Ludford Park",Assemblage,Silurian Period,Salopina lunata; Microsphaeridiorhynchia nucula; Protochonetes ludloviensis,https://data.nhm.ac.uk/media/ludlow:G.17882a.jpg,images/8495_Silurian_Period_Assemblage.jpg
8247,Fossilised remains of an Ordovician bryozoan. Found at Acton Scott Quarry.,Bryozoan,Ordovician Period,,https://data.nhm.ac.uk/media/ludlow:G.14658.jpg,images/8247_Ordovician_Period_Bryozoan.jpg
8326,"Fossilised remains of the central portion of a large mammal vertebra, probably from an extinct type of elephant from the Siwalik Hills of India.",Elephant; Vertebra,Cenozoic Era,Elephantidae,https://data.nhm.ac.uk/media/ludlow:G.15191b.jpg,images/8326_Cenozoic_Era_Elephant;_Vertebra.jpg
7607,Fossilised remains of the Silurian graptolite Pristiograptus sp. found in Mortimer Forest.,Graptolite,Silurian Period,,https://data.nhm.ac.uk/media/ludlow:G.09106a.jpg,images/7607_Silurian_Period_Graptolite.jpg
7462,"Fossilised remains of the ventral headshield of the Devonian heterostracan fish Phialaspis symondsi, found at Devils Hole, Shropshire.",Fish,Devonian Period,Phialaspis symondsi,https://data.nhm.ac.uk/media/ludlow:G.08170.002.jpg,images/7462_Devonian_Period_Fish.jpg
8507,"A near complete, conical corallum of the Silurian solitary rugose coral, Ketophyllum subturbinatum, found on Wenlock Edge.",CORAL,Silurian Period,Ketophyllum subturbinatum,https://data.nhm.ac.uk/media/ludlow:G.18326a.jpg,images/8507_Silurian_Period_CORAL.jpg
8266,"Fossilised remains of the Silurian graptolite Saetograptus leintwardinensis. Found by Smith, R. at Church Hill.",Graptolite,Silurian Period,Saetograptus leintwardinensis,https://data.nhm.ac.uk/media/ludlow:G.14780a.jpg,images/8266_Silurian_Period_Graptolite.jpg
8371,"Fossilised shell remains of the Silurian gastropod Poleumita discors found on Wenlock Edge, Shropshire.",Gastropod,Silurian Period,Poleumita discors,https://data.nhm.ac.uk/media/ludlow:G.16002.jpg,images/8371_Silurian_Period_Gastropod.jpg
8400,Fossilised shell remains of the Silurian gastropod Poleumita sp. Found at Farley Quarry.,Gastropod,Silurian Period,Poleumita sp.,https://data.nhm.ac.uk/media/ludlow:G.16252.jpg,images/8400_Silurian_Period_Gastropod.jpg
8425,"Fine grained sandstone showing fine sedimentary ripple marks. Found near Wentnor, Shropshire",Sandstone,Precambrian Eon,Sandstone,https://data.nhm.ac.uk/media/ludlow:G.16524.001.jpg,images/8425_Precambrian_Eon_Sandstone.jpg
7679,"Fossilised calcaneum from the lower left leg of an extinct species of deer. Found in the Siwalik Hills, India. Original collectors label is still attached to the specimen.",Deer; Calcaneum,Cenozoic Era,Cervidae,https://data.nhm.ac.uk/media/ludlow:G.09895a.jpg,images/7679_Cenozoic_Era_Deer;_Calcaneum.jpg
7682,"Fossilised remains of lower right canine tooth of an extinct Cave Hyaena, Croccuta crocuta spelaea. Found in the Siwalik Hills, India",Cave Hyaena; Tooth,Cenozoic Era,Crocuta crocuta spelaea,https://data.nhm.ac.uk/media/ludlow:G.09901.jpg,images/7682_Cenozoic_Era_Cave_Hyaena;_Tooth.jpg
8376,"Jurassic fossil ammonite, Arnioceras sp.",AMMONITE,Jurassic Period,Arnioceras sp.,https://data.nhm.ac.uk/media/ludlow:G.16063.jpg,images/8376_Jurassic_Period_AMMONITE.jpg
7610,"Fossilised fragments of the Silurian graptolite Saetograptus leintwardinensis. Found at Church Hill, near Leintwardine.",Graptolite,Silurian Period,Saetograptus leintwardinensis,https://data.nhm.ac.uk/media/ludlow:G.09132.jpg,images/7610_Silurian_Period_Graptolite.jpg
8248,"Fossilised remains of a Silurian graptolite Pristiograptus sp, alongside fragment of the cephalopod Michelinoceras sp. Found at Trippleton.",Graptolite,Silurian Period,Pristiograptus sp.; Michelinoceras sp.,https://data.nhm.ac.uk/media/ludlow:G.14665.jpg,images/8248_Silurian_Period_Graptolite.jpg
8511,Fossilised remains of the Jurassic ammonite Cardioceras sp.,AMMONITE,Jurassic Period,Cardioceras sp.,https://data.nhm.ac.uk/media/ludlow:G.18624.jpg,images/8511_Jurassic_Period_AMMONITE.jpg
8277,Fossilised remains of the Silurian graptolite Neodiversograptus nilssoni. Found near Aston Pitch.,Graptolite,Silurian Period,Neodiversograptus nilssoni,https://data.nhm.ac.uk/media/ludlow:G.14828.jpg,images/8277_Silurian_Period_Graptolite.jpg
8404,Fossilised shell remains of the Silurian gastropod Poleumita sp. found at Burrington,Gastropod,Silurian Period,Poleumita sp.,https://data.nhm.ac.uk/media/ludlow:G.16285.jpg,images/8404_Silurian_Period_Gastropod.jpg
8405,Fossilised shell remains of the Silurian gastropod Poluemta funatus found at Farley Quarry Shropshire,Gastropod,Silurian Period,Poleumita funatus,https://data.nhm.ac.uk/media/ludlow:G.16299.jpg,images/8405_Silurian_Period_Gastropod.jpg
7465,"Fossilised part a juvenile lateral plate of the Late Silurian fish, Phialaspis symondsi. From the Downton Castle Sandstone",Fish,Devonian Period,Phialaspis symondsi,https://data.nhm.ac.uk/media/ludlow:G.08174a.jpg,images/7465_Devonian_Period_Fish.jpg
8272,"Fossilised fragments of Silurian graptolites Pristiograptus tumescens found at Gorsty, Mortimer Forest, Ludlow.",Graptolite,Silurian Period,Pristiograptus tumescens,https://data.nhm.ac.uk/media/ludlow:G.14807a.jpg,images/8272_Silurian_Period_Graptolite.jpg
7689,"['Fossilised remains of a part of the lower jaw including a fragment of tooth of an extinct type of elephant.', 'elephant']",Elephant; Jaw,Cenozoic Era,Elephantidae,https://data.nhm.ac.uk/media/ludlow:G.09909a.jpg,images/7689_Cenozoic_Era_Elephant;_Jaw.jpg
7439,"Fossilized remains of the Devonian jawless fish Kallostrakon sp. found at Foxall Copice, Monkhopton.",Fish,Devonian Period,Kallostrakon sp.,https://data.nhm.ac.uk/media/ludlow:G.08132.jpg,images/7439_Devonian_Period_Fish.jpg
8387,"Fossilised remains of the Jurassic ammonite, Pavlovia sp. found at Kimmeridge, Dorset.",AMMONITE,Jurassic Period,Pavlovia sp.,https://data.nhm.ac.uk/media/ludlow:G.16138.001.jpg,images/8387_Jurassic_Period_AMMONITE.jpg
8439,"Small sample of Precambrian sedimentary rock, fine grained sandstone.",Sandstone,Precambrian Eon,Sandstone,https://data.nhm.ac.uk/media/ludlow:G.16528.jpg,images/8439_Precambrian_Eon_Sandstone.jpg
8559,"Fossilized rostrum fragment of the Belemnite, Belemnites sulcatus, showing a section of phragmacone and rostrum. Jurassic period. Found at Wolvercote 1925. Part 3 of 3.",Belemnite,Jurassic Period,Belemnites sulcatus,https://data.nhm.ac.uk/media/ludlow:G.20046.003.jpg,images/8559_Jurassic_Period_Belemnite.jpg
8421,"Fossilised remains of Silurian worm burrows Keilorites squamosus. Found at Whitcliffe, Ludlow.",Trace fossil,Silurian Period,Keilorites squamosus,https://data.nhm.ac.uk/media/ludlow:G.16427.jpg,images/8421_Silurian_Period_Trace_fossil.jpg
7782,"Fossilised remains of Ordovician trilobolite Ampyx linleyensis found at the Shelve Inlier, Shropshire",Trilobite,Ordovician Period,Ampyx linleyensis,https://data.nhm.ac.uk/media/ludlow:G.10571a.jpg,images/7782_Ordovician_Period_Trilobite.jpg
7480,"Fossilised remains of ventral shield of the Devonian heterostracan fish Phialaspis symondsi found at Devil's Hole, Shropshire.",Fish,Devonian Period,Phialaspis symondsi,https://data.nhm.ac.uk/media/ludlow:G.08197.002.jpg,images/7480_Devonian_Period_Fish.jpg
8557,"Fossilized rostrum (guard) fragment of the Belemnite, Belemnites sulcatus, showing cast impression of a section of phragmacone. Jurassic period. Found at Wolvercote 1925. Part 1 of 3, counterpart to G.20046.002",Belemnite,Jurassic Period,Belemnites sulcatus,https://data.nhm.ac.uk/media/ludlow:G.20046.001.jpg,images/8557_Jurassic_Period_Belemnite.jpg
8505,"Fossilised shell remains of the Jurassic brachiopod Goniorhynchia boueti, preserved in  boueti beds. Found near Weymouth.",Brachiopod,Jurassic Period,Goniorhynchia boueti,https://data.nhm.ac.uk/media/ludlow:G.18043.003.jpg,images/8505_Jurassic_Period_Brachiopod.jpg
7458,Fossilised rermains of the Devonian heterostracan fish Phialaspis symondsi found at Devils Hole. Figured specimen.,Fish,Devonian Period,Phialaspis symondsi,https://data.nhm.ac.uk/media/ludlow:G.08168.001.jpg,images/7458_Devonian_Period_Fish.jpg
8391,"Fossilised remains of the Cretaceous ammonite, Olcostephanus sayni. The shell is involute and possesses a deep umbilicus. Fine transverse ribbing is continuous across the venter.",AMMONITE,Cretaceous Period,Olcostephanus sayni.,https://data.nhm.ac.uk/media/ludlow:G.16155.jpg,images/8391_Cretaceous_Period_AMMONITE.jpg
8443,"Poorly sorted conglomerate, from south-west of Greyfields Court.",Sedimentary Rock,Carboniferous Period,Conglomerate,https://data.nhm.ac.uk/media/ludlow:G.16563.jpg,images/8443_Carboniferous_Period_Sedimentary_Rock.jpg
7699,"Fossilised remains of head-shield of the Silurian Aganthian fish Didymaspis sp. Found at Landslip site, Cusop.",Fish,Silurian Period,Didymaspis sp.,https://data.nhm.ac.uk/media/ludlow:G.09927.002.jpg,images/7699_Silurian_Period_Fish.jpg
8357,"Fossilised remains of four lumbar vertebra from an extinct type of elephant, labelled as Palaeoloxodon sp. Found  in the Siwalik Hills of India.",Elephant; Vertebra,Cenozoic Era,Palaeoloxodon sp.,https://data.nhm.ac.uk/media/ludlow:G.15242a.jpg,images/8357_Cenozoic_Era_Elephant;_Vertebra.jpg
8440,"Small sample of Precambrian sedimentary rock, fine grained sandstone.",,Precambrian Eon,Sandstone,https://data.nhm.ac.uk/media/ludlow:G.16529.jpg,images/8440_Precambrian_Eon_nan.jpg
8420,"Fossilised remains of the Silurian cricoconarida Cornulites serpularius found by Fraser, N. at Whitcliffe, Ludlow. Counterpart of G.16411.001.",Cricoconarida,Silurian Period,Cornulites serpularius,https://data.nhm.ac.uk/media/ludlow:G.16411.002.jpg,images/8420_Silurian_Period_Cricoconarida.jpg
8283,Fossilised remains of the Silurian gastropod Platyschisma helicites and the and bivalve Modiolopsis complanata. Found at Clun. Preserved as internal casts and moulds.,Gastropod,Silurian Period,Platyschisma helicites; Modiolopsis complanata,https://data.nhm.ac.uk/media/ludlow:G.14923a.jpg,images/8283_Silurian_Period_Gastropod.jpg
7701,Fossilised remains of a head-shield of the Silurian fish Didymaspis sp. found at Cusop.,Fish,Silurian Period,Didymaspis sp.,https://data.nhm.ac.uk/media/ludlow:G.09934.jpg,images/7701_Silurian_Period_Fish.jpg
7577,Fragmentary remains of the Silurian graptolite Pristiograptus sp.,Graptolite,Silurian Period,Pristiograptus sp.,https://data.nhm.ac.uk/media/ludlow:G.08968a.jpg,images/7577_Silurian_Period_Graptolite.jpg
7513,Fossilised remains of the Devonian boney fish Dickosteus sp. found at Dippel Brae,Fish,Devonian Period,Dickosteus sp.,https://data.nhm.ac.uk/media/ludlow:G.08531b.jpg,images/7513_Devonian_Period_Fish.jpg
8427,Fine grained precambrian sandstone showing ripple marks.,Sandstone,Precambrian Eon,Sandstone,https://data.nhm.ac.uk/media/ludlow:G.16525.001.jpg,images/8427_Precambrian_Eon_Sandstone.jpg
7618,"Fossilised remains of the Silurian Osteostracan armoured fish Cephalaspis sp. found at Devils Hole, Morville.",Fish,Silurian Period,Cephalaspis sp.,https://data.nhm.ac.uk/media/ludlow:G.09351.jpg,images/7618_Silurian_Period_Fish.jpg
8509,"Slab of red limestone containing ammonites, belemnites and gryphaea bivalves from the Lower Lias of the Jurassic.",BIVALVE,Jurassic Period,Gryphaea sp.; Ammonoidea; Belemnitida,https://data.nhm.ac.uk/media/ludlow:G.18571.jpg,images/8509_Jurassic_Period_BIVALVE.jpg
8361,Fossilised remains of a Jurassic Ammonite.,AMMONITE,Jurassic Period,CEPHALOPODA,https://data.nhm.ac.uk/media/ludlow:G.15522.jpg,images/8361_Jurassic_Period_AMMONITE.jpg
7639,"A death assemblage of complete and incomplete shells of a Palaeogene mussel. The shells are asymmetrical in form, with nacre visible both internally and externally. The internal shell margins are finely crenulated. Found in London Clay.",BIVALVE,Cenozoic Era,BIVALVIA,https://data.nhm.ac.uk/media/ludlow:G.09484a.jpg,images/7639_Cenozoic_Era_BIVALVE.jpg
8431,"Small sample of fine grained Precambrian sandstone showing fine sedimentary banding, found near Wentnor, Shropshire.",,Precambrian Eon,,https://data.nhm.ac.uk/media/ludlow:G.16525.005b.jpg,images/8431_Precambrian_Eon_nan.jpg
7528,Fossilised remains of the nuchal plate of a Devonian fish Coccosteus cuspidatus found at Ross & Cromarty.,Fish,Devonian Period,Coccosteus cuspidatus,https://data.nhm.ac.uk/media/ludlow:G.08620.jpg,images/7528_Devonian_Period_Fish.jpg
8388,"Fossilised remains of the Jurassic ammonite, Pavlovia sp. found at Kimmeridge, Dorset.",AMMONITE,Jurassic Period,Pavlovia sp.,https://data.nhm.ac.uk/media/ludlow:G.16138.002.jpg,images/8388_Jurassic_Period_AMMONITE.jpg
8519,"Part phragmocone of a large Orthoceras ludense cephalopod fossil, showing coarse calcite crystallisation internally, and two partial septal surfaces.",Cephalopod,Silurian Period,Orthoceras ludense,https://data.nhm.ac.uk/media/ludlow:G.19001a.jpg,images/8519_Silurian_Period_Cephalopod.jpg
8463,Fossilised remains of a Silurian tabulate coral.,CORAL,Silurian Period,,https://data.nhm.ac.uk/media/ludlow:G.17529.jpg,images/8463_Silurian_Period_CORAL.jpg
7859,Fossilised shell remains of the Silurian gastropod Poleumita discors. Found at Wenlock Edge,Gastropod,Silurian Period,Poleumita discors,https://data.nhm.ac.uk/media/ludlow:G.11988a.jpg,images/7859_Silurian_Period_Gastropod.jpg
8392,"Fossilised remains of the Jurassic ammonite, Dactylioceras commune, found at Ravenscar Bay, near Whitby.",AMMONITE,Jurassic Period,Dactylioceras commune,https://data.nhm.ac.uk/media/ludlow:G.16160.jpg,images/8392_Jurassic_Period_AMMONITE.jpg
8523,"Well preserved fossilised remains of part of the chitinous, segmented carapace of an Eocene lobster. The fossil is preserved within a nodule. Collected from the London Clay.",Lobster,Cenozoic Era,Decapoda,https://data.nhm.ac.uk/media/ludlow:G.19521.jpg,images/8523_Cenozoic_Era_Lobster.jpg
8596,"Fossilised remains of a Silurian arthopod, possibly a trilobite showing the preservation of hypostome and a series of paired legs.",Trilobite,Silurian Period,TRILOBITA,https://data.nhm.ac.uk/media/ludlow:G.20102a.jpg,images/8596_Silurian_Period_Trilobite.jpg
8433,Fine grained precambrian sandstone showing fine sedimentary banding,Sandstone,Precambrian Eon,Sandstone,https://data.nhm.ac.uk/media/ludlow:G.16525.008.jpg,images/8433_Precambrian_Eon_Sandstone.jpg
8198,Fossilised remains of the Carboniferous pteridosperm Neuropteris sp. - leaves in matrix. Collected from the Coal Measures.,Plant,Carboniferous Period,Neuropteris sp.,https://data.nhm.ac.uk/media/ludlow:G.14394.jpg,images/8198_Carboniferous_Period_Plant.jpg
8412,"Fossilised remains of the Silurian gastropod Platyceras sp, Found at Farley.",Gastropod,Silurian Period,Platyceras sp.; Gastropod,https://data.nhm.ac.uk/media/ludlow:G.16334.jpg,images/8412_Silurian_Period_Gastropod.jpg
7595,Fossilised fragments of the Silurian graptolite Monograptus sp. Specimen also contains fragments of orthocone cephalopods. Found at Nant Prophwyd.,Graptolite,Silurian Period,Pristiograptus sp.,https://data.nhm.ac.uk/media/ludlow:G.09061.jpg,images/7595_Silurian_Period_Graptolite.jpg
8471,Fossilised remains of Silurian stromatoporoid found at Dodmore.,Stromatoporoid,Silurian Period,,https://data.nhm.ac.uk/media/ludlow:G.17731.001.jpg,images/8471_Silurian_Period_Stromatoporoid.jpg
7870,Fossilised remains of a Silurian Stromatoporoid. Found in Ludlow Town.,Stromatoporoid,Silurian Period,,https://data.nhm.ac.uk/media/ludlow:G.12011.jpg,images/7870_Silurian_Period_Stromatoporoid.jpg
8457,"Fossilised remains of a telson of a Silurian eurypterid, Slimonia acuminata. Found at Lesmahagow.",Eurypterid,Silurian Period,Slimonia acuminata,https://data.nhm.ac.uk/media/ludlow:G.17344.jpg,images/8457_Silurian_Period_Eurypterid.jpg
8530,"Dark coloured sandstone containing the Silurian fossil brachiopods, Lingula cornea. Found in the Morville district.",Brachiopod,Silurian Period,Lingula cornea,https://data.nhm.ac.uk/media/ludlow:G.19720.jpg,images/8530_Silurian_Period_Brachiopod.jpg
8429,Fine grained precambrian sandstone showing fine sedimentary banding,Sandstone,Precambrian Eon,Sandstone,https://data.nhm.ac.uk/media/ludlow:G.16525.003.jpg,images/8429_Precambrian_Eon_Sandstone.jpg
8446,Sample of Precambrian purple Haughmond conglomerate rock. Found at Haughmond Hill.,Conglomerate,Precambrian Eon,Haughmond Conglomerate,https://data.nhm.ac.uk/media/ludlow:G.16569.jpg,images/8446_Precambrian_Eon_Conglomerate.jpg
8623,"Fossilised fragmented Devonian plant remains found at Meadowley Wood, Morville, Shropshire.",Plant,Devonian Period,Plantae,https://data.nhm.ac.uk/media/ludlow:G.20135.jpg,images/8623_Devonian_Period_Plant.jpg
7829,"Fossilised remains of the Silurian trilobite Phacopid sp. preserved in its curled up form. Found at Buildwas, Ironbridge, Shropshire.",Trilobite,Silurian Period,Phacopid sp.,https://data.nhm.ac.uk/media/ludlow:G.11781a.jpg,images/7829_Silurian_Period_Trilobite.jpg
8382,"Fossilised remains of upper jurassic ammonite, found at Kimmeridge, Dorset.",AMMONITE,Jurassic Period,Pavlovia sp.,https://data.nhm.ac.uk/media/ludlow:G.16097.jpg,images/8382_Jurassic_Period_AMMONITE.jpg
7548,"Fossilised remains of part of a fin from the Devonian lung fish, Dipterus sp. found at Shingly Geo, Shetland",Fish,Devonian Period,Dipterus sp.,https://data.nhm.ac.uk/media/ludlow:G.08723.002.jpg,images/7548_Devonian_Period_Fish.jpg
8299,"Fossilised fragment of thoracic vertebra of an extinct species of Bison. Neural spine and transverse processes are missing. Found in the Siwalik Hills, India. An original label is attached to the vertebral body.",Bison; Vertebra,Cenozoic Era,Bison,https://data.nhm.ac.uk/media/ludlow:G.15142a.jpg,images/8299_Cenozoic_Era_Bison;_Vertebra.jpg
8218,Fossilised remains of Carboniferous pteridosperm plant Cyclopteris orbicularis.,Plant,Carboniferous Period,Cyclopteris orbicularis,https://data.nhm.ac.uk/media/ludlow:G.14480.002.jpg,images/8218_Carboniferous_Period_Plant.jpg
7860,"Fossilised shell remains of the Silurian gastropod Acroculia prototypa found at Wrens Nest, Dudley.",Gastropod,Silurian Period,Acroculia prototypa,https://data.nhm.ac.uk/media/ludlow:G.11989a.jpg,images/7860_Silurian_Period_Gastropod.jpg
8401,"Fossilised shell remains of the Silurian gastropod Poleumita sp. found by Phillips, N.M. at Rubery.",Gastropod,Silurian Period,Poleumita sp.,https://data.nhm.ac.uk/media/ludlow:G.16267.jpg,images/8401_Silurian_Period_Gastropod.jpg
7642,"Fossilised remains of part of Silurian phyllocarid, Ceratiocaris sp. Found by Smith, R.D.A. at Brandon Hill.",Phyllocarid,Silurian Period,Ceratiocaris sp.,https://data.nhm.ac.uk/media/ludlow:G.09523.016.jpg,images/7642_Silurian_Period_Phyllocarid.jpg
8593,"Part of the Devonian lung fish, Dipterus sp. showing numerous overlapping scales.",Fish,Devonian Period,Dipterus sp.,https://data.nhm.ac.uk/media/ludlow:G.20099a.jpg,images/8593_Devonian_Period_Fish.jpg
8647,"Fragmentary remains of Carboniferous fern fronds. Found at Lynemouth, Northumberland.",Plant,Carboniferous Period,,https://data.nhm.ac.uk/media/ludlow:G.20175a.jpg,images/8647_Carboniferous_Period_Plant.jpg
7716,Fossilisd remains of a large fragment of spine from a Silurian Cephalaspid fish. The spine shows longitudinal ribbing. Part and counterpart with G.09968.001,Fish,Silurian Period,,https://data.nhm.ac.uk/media/ludlow:G.09968.002b.jpg,images/7716_Silurian_Period_Fish.jpg
8572,Fossilised remains of the Silurian jawless fish Sclerodus pustuliferous,Fish,Silurian Period,Sclerodus pustuliferous,https://data.nhm.ac.uk/media/ludlow:G.20071.jpg,images/8572_Silurian_Period_Fish.jpg
8485,"Silurian assemblage with fragments of corals, bryozoans, brachiopods, trilobites and crinoid columns found at Wren's Nest, Dudley",Assemblage,Silurian Period,,https://data.nhm.ac.uk/media/ludlow:G.17778a.jpg,images/8485_Silurian_Period_Assemblage.jpg
7654,"Fragments of phragmocones of Orthoceras ibex, Orthoceras sp. and Cyrtoceras sp. cephalopod fossil with fragments of Serpulites longissimus fossil.",Cephalopod,Silurian Period,Othoceras sp.,https://data.nhm.ac.uk/media/ludlow:G.09568.002.jpg,images/7654_Silurian_Period_Cephalopod.jpg
7617,Fossilised remains of a curved Ordovician graptolite. Found at Llanfawr Quarry.,Graptolite,Ordovician Period,Graptoloidea,https://data.nhm.ac.uk/media/ludlow:G.09223.jpg,images/7617_Ordovician_Period_Graptolite.jpg
